tweet_id,kurdish_tweets,sentiment,author,content,tweets,kurdish_sentiments
1752321805,داپیرە، لیندا دڵخۆش دەبێت.,happiness,JeanneEEE,"@gemstwin Granny, Linda will be happy.","Granny, Linda will be happy.",بەختەوەر
1752321835,ئیم حەزم لە ڕزگاربوونە لە چارەنووس alot ئەمشەو. پەرۆش بووم بۆ ESTK NemoNemesis,love,nemonemesis,Im liking escape the fate alot tonight.  excited for ESTK      NemoNemesis,Im liking escape the fate alot tonight. excited for ESTK NemoNemesis,خۆشەویستی
1752321848,بەڵێ! حەوزەکە لەم کۆتایی هەفتەیەدا کرایەوە,fun,floridiantwist,@aramos82 yes! the pool opened this weekend,yes! the pool opened this weekend,خۆشی
1752321903,ئەمڕۆ دەگەم بە خەوتن لەناو!,neutral,katrivinna,today i get to sleep in!,today i get to sleep in!,ئاسایی
1752321929,رۆژی دایکان پیرۆز بێت!!!,love,seyerneelie14,happy mother's day!!!,happy mother's day!!!,خۆشەویستی
1752321933,پێی وایە قەڵاکان خۆشن,happiness,seleneybeany,thinks castles are fun,thinks castles are fun,بەختەوەر
1752321945,سوپاس ئیمی، پڕە لە گەرمی,happiness,beebees27,"@MsKnitSox thanks amy, its full of hotness","thanks amy, its full of hotness",بەختەوەر
1752321961,ڕۆژی دایکان پیرۆز بێت لە هەموو دایکان!!!!!!!!!!!!,happiness,JoViii,HAPPY MOTHERS DAY TO ALL THE MOMMYS!!!!!!!!!!!!,HAPPY MOTHERS DAY TO ALL THE MOMMYS!!!!!!!!!!!!,بەختەوەر
1752322000,کارتی دەستی Etsy هیچ باش نەبوون؟,worry,chyrls,@stovertile Etsy handmade cards weren't any good?,Etsy handmade cards weren't any good?,نیگەران
1752322036,wooo...بەختی من تەواو بوو,fun,JHNNAI,wooo...my luck is done,wooo...my luck is done,خۆشی
1752322038,خواردنەوەکان &amp;&amp; din w/ ئیمی و لۆری,happiness,jenninabox,Drinks &amp;&amp; din w/ Amy and Lori,Drinks &amp;&amp; din w/ Amy and Lori,بەختەوەر
1752322091,وە کێ دەڵێت من تەنها لە دڵی خۆمدا گەمژە نەبووم؟,neutral,grevian,@aeakett And who says I wasn't just muttering to myself?,And who says I wasn't just muttering to myself?,ئاسایی
1752322136,پێویستی بە هەڵهاتن هەیە لەم شارۆچکەیە. خۆ ئامادەکردن. seeyuhhh.,enthusiasm,laurieloo27,needs to escape from this town. getting ready. seeyuhhh.,needs to escape from this town. getting ready. seeyuhhh.,پەرۆش
1752322162,فێستیڤاڵی تەواوی زەوی,empty,sunnysmilixer,@duckout Whole Earth Festival,Whole Earth Festival,بەتاڵ
1752322163,بەخێربێن بۆ 5 فۆڵۆوەری نوێ سوپاس، من شەرەفمەندم.,happiness,BUTTERFLYWHEEL,"Welcome aboard to 5 new followers  Thanks, I'm honored.","Welcome aboard to 5 new followers Thanks, I'm honored.",بەختەوەر
1752322173,باوەڕ ناکەم چەند کەس پێیان وایە زۆر باشە کە من لە کویزەکەدا دەرچووم، &quot;تۆ چەندە شۆخی؟&quot; لە فەیسبووک. من زۆر شۆخ و شەنگم!,neutral,areucrazy,"I can't believe how many people think it is great that I passed the quiz, &quot;how blond are you?&quot; on Facebook.  I am very blond!","I can't believe how many people think it is great that I passed the quiz, &quot;how blond are you?&quot; on Facebook. I am very blond!",ئاسایی
1752322190,بەڵێ!! ئێوە FTW!!!!! LMAO من سەیری نەدەکرد,fun,Melamachinko,@lo_ferrigno YES!! YOU FTW!!!!! LMAO i wasnt watching,YES!! YOU FTW!!!!! LMAO i wasnt watching,خۆشی
1752322242,ستار ترێک لە ئایماکس لەگەڵ کۆجیکۆن و سیستار و برایان و جۆرج.,neutral,ariel_mog,"Star Trek in IMAX  with Kojikun, seastar, Brian, and George.","Star Trek in IMAX with Kojikun, seastar, Brian, and George.",ئاسایی
1752322245,ناتوانێت واز لە یاریکردنی Fallout 3 بهێنێت! ئەم یارییە وەک کراک ئالوودەبوونە!! خراپە کاتێک لە خەودا دەبینیت کە دەمانچە چاککردنەوەکانت لە خەودا,love,Endorphine,can't stop playing Fallout 3!  This game is addictive like crack!!  It's bad when you dream that your repairing guns in your sleep,can't stop playing Fallout 3! This game is addictive like crack!! It's bad when you dream that your repairing guns in your sleep,خۆشەویستی
1752322345,زەڵاتەیەکی نایابی هەبوو! پێشنیار دەکەم زەڵاتەی مریشکی سپایسی بوفالۆ بەدەست بهێنیت!,happiness,seoulfood12,had an awsome salad! I recommend getting the Spicey buffalo chicken salad!,had an awsome salad! I recommend getting the Spicey buffalo chicken salad!,بەختەوەر
1752322359,ڕۆژی دایکان پیرۆز بێت لە هەموو motherssss! &lt;3333,love,fatimarose,happy mothers day to all motherssss!  &lt;3333,happy mothers day to all motherssss! &lt;3333,خۆشەویستی
1752322372,نەخێر من دایکم و باوکم نیم، هەمم باشە لینکەکە بۆ دایکم دەنێرم. ئێستا شەرمەزارم,worry,mrlarrygreen,"@TheDailyBlonde No i am not a mom or dad, hmm well I will forward the link to my mom.  I am embarrassed now","No i am not a mom or dad, hmm well I will forward the link to my mom. I am embarrassed now",نیگەران
1752322414,HIII!!!! بیری تۆم کردووە تەنها بێزار بووم....ئەی تۆ؟,enthusiasm,mytimeishere,@TheWayIRoll HIII!!!!  i've missed you  just bored....what about u?,HIII!!!! i've missed you just bored....what about u?,پەرۆش
1752322437,باشە ئەوە ئێوارەیەکی خۆش بوو,neutral,ebfulch,Well that was a fun evening,Well that was a fun evening,ئاسایی
1752322438,thats بۆچی من وەها کەرێک,fun,rafamejia,@neeliemoo thats why im such an asshole,thats why im such an asshole,خۆشی
1752322451,omgoodness لە کۆتاییدا لە ژەمی ئێوارە لەگەڵ fam bam گەڕاینەوە!,happiness,HaloLoves,omgoodness FINALLY back from dinner with the fam bam!,omgoodness FINALLY back from dinner with the fam bam!,بەختەوەر
1752322579,ئێدجفێست! یان ڕەنگە لەبەر ئەوەی تۆ شۆفێری دەکەیت...,worry,brantim,@rustycoon Edgefest!  or maybe  since you're driving...,Edgefest! or maybe since you're driving...,نیگەران
1752322641,خەلکی شەو!!!!!,happiness,danger11,NITE PEOPLES!!!!!,NITE PEOPLES!!!!!,بەختەوەر
1752322715,ئەمڕۆ لەدەست نەچووە,happiness,cwarden,Today is not lost,Today is not lost,بەختەوەر
1752322749,بەسەربردنی کات لەگەڵ دایکم سبەی بەیانی...بارباکۆا، لێرەدا دێم... ڕۆژی دایکان پیرۆز بێت!,love,BrenxGtz,"Spending time with mom tomorrow morning...barbacoa, here I come...  HAPPY MOTHERS DAY!","Spending time with mom tomorrow morning...barbacoa, here I come... HAPPY MOTHERS DAY!",خۆشەویستی
1752322766,بە تەواوی باوەڕپێنەکراوە. فەرمییە: جۆناسە خۆشەویستەکەم FRANKIE ە. ئەو پیاوە,happiness,k_ferrante,@Jonasbrothers It is absolutely incredible. It's official: My FAVORITE JONAS is FRANKIE. He is the man,It is absolutely incredible. It's official: My FAVORITE JONAS is FRANKIE. He is the man,بەختەوەر
1752322923,بەڵێ جیمی فالۆن گەڕاوەتەوە بۆ ئەوەی سکیتێک بکات. لێێێێێدا!!!!,love,Mottchick88,"@southernbell361 Yeah, Jimmy Fallon is back to do a skit. Yay!!!!","Yeah, Jimmy Fallon is back to do a skit. Yay!!!!",خۆشەویستی
1752322928,هەمم من پێشبینی دەکەم جیهان بەرەو کوێ دەڕوات 2day....با پێشبینی بکەین,worry,Thats_Aryan,Hmm I guess where the world is headed 2day....Lets make predictions,Hmm I guess where the world is headed 2day....Lets make predictions,نیگەران
1752322982,بەرنامەی قسەکردنی باری گیب!!!!!,neutral,jwonderwall,The Barry Gibb Talk show!!!!!,The Barry Gibb Talk show!!!!!,ئاسایی
1752322988,ئەم دۆخە سەختانە ناچارمان دەکەن بیر لە شووکردن بە کچێکی خۆشەویست بکەینەوە,worry,deepeshdeo,These difficult situation force us to think about marrying a lovable girl,These difficult situation force us to think about marrying a lovable girl,نیگەران
1752323014,بۆیە بەجدی...پێویستم بە ڕێکەوتێکە بۆ ئاهەنگی هاوسەرگیری. بەڕاستی ناتەوێت بە تەنیا بچم. ٢٣ی ئایارەکەی...هیچ چانسێک؟,worry,geminigirl80,@JonathanRKnight so seriously...I need a date to a wedding. Really dont wanna go alone. Its May 23rd...any chance?,so seriously...I need a date to a wedding. Really dont wanna go alone. Its May 23rd...any chance?,نیگەران
1752323131,هەی، سەیرکە کێ لە تویتەرە زۆر kewl,surprise,DanRegalia,"@VSchlesinger Hey, look who's on twitter   Very kewl","Hey, look who's on twitter Very kewl",سوپرایز
1752323140,شەوێکی خۆشی تر!! chilled wit my homie سەوز کیسەڵ n پارک ....کاتی خۆش...کاتی خۆش.,happiness,curamelshawty,another fun night!!  chilled wit my homie @ green turtle n the park....good times...good times.,another fun night!! chilled wit my homie green turtle n the park....good times...good times.,بەختەوەر
1752323162,باشە، ئەوە هەیە کە...,neutral,dougwo,"@ScottATaylor Well, there is THAT...","Well, there is THAT...",ئاسایی
1752323198,من لەگەڵ براکەمدا لە بیرە پۆنگدا سەرسوڕهێنەر دەکەم,worry,strutterrr,I do amazing at beer pong with my brother,I do amazing at beer pong with my brother,نیگەران
1752323232,سەرسوڕهێنەر بوو بەڵام بەهۆی کەمی کاتەوە تەنها توانی سەردانی چۆڵەوانی و دارستانی سنەوبەر بکات. دواتر وێنەکان بڵاودەکاتەوە.,happiness,crazytwism,@remzology it was amazing but due to time constraints could only visit the meadows and pine forest. Shall post images later.,it was amazing but due to time constraints could only visit the meadows and pine forest. Shall post images later.,بەختەوەر
1752323252,شەوتان باش و ماڵئاوا ؟,neutral,paaulitaa,Goodnight and Goodbye ?,Goodnight and Goodbye ?,ئاسایی
1752323264,بیانکوژێنەرەوە، هێشتا دەتوانیت 100% بەبێ ئایرۆ بچیت.,enthusiasm,brendanb,"@jark turn them off, you can still go 100% aero free.","turn them off, you can still go 100% aero free.",پەرۆش
1752323306,من بە تەواوی لەگەڵ ئەوەدام,neutral,ReikiAwakening,@resofactor I agree completely,I agree completely,ئاسایی
1752323383,"بۆ دایکانم . من زۆرم خۆشدەوێت , Ur زۆر سەربەخۆ &amp; بەهێز و هیوادارم هەموو کارێک کە لە ژیاندا ئەنجامی دەدەم دڵخۆشت بکات. خۆشەویستی ur 1st لەدایکبوو مێل",love,YoungCeothaBoss,"To My Moms . I Love u so much , Ur so independent &amp; strong and I hope everything I do in life keeps u happy. Love ur 1st born Mel","To My Moms . I Love u so much , Ur so independent &amp; strong and I hope everything I do in life keeps u happy. Love ur 1st born Mel",خۆشەویستی
1752323416,شەوێکی خۆشم بەسەر برد لەگەڵ جەستن و کوڕەکان و هەموو ئەو کەسانەی وێستکۆن کە ئەمشەو ناسیم هاها,happiness,jord0,I had a GREAT night with Justine and the boys and all the westconn people I met tonight haha,I had a GREAT night with Justine and the boys and all the westconn people I met tonight haha,بەختەوەر
1752323526,شیرین! من کەسێکی یەک پیتی جەیسیم پێم وایە. تەنها D!,fun,sweetdreamer,@oheather78 Sweet! I'm a Jaycee one-letter-er I think. Just D!,Sweet! I'm a Jaycee one-letter-er I think. Just D!,خۆشی
1752323532,ئاه، ئەو جارێکی تر دەگەڕێتەوە.........و YO' AZZ BETTA MAKE A VID دەربارەی YO' PROM BOY,sadness,26c4u,"@JoWork oh, she gon com back again.........AND YO' AZZ BETTA MAKE A VID ABOUT YO' PROM BOY","oh, she gon com back again.........AND YO' AZZ BETTA MAKE A VID ABOUT YO' PROM BOY",دڵتەنگ
1752323540,&quot;گراڤێرۆبەر، گڕاڤەرۆبەر، هەندێک جار پێم سەیرە بۆچی تەنانەت بێزاریش دەکەم..&quot; ئەمشەو کاتێکی خۆش بەسەر بەرە!,surprise,WhirlwindMuse,"@lazakesau &quot;Graverobber, graverobber, sometimes I wonder why I even bother..&quot; Have fun tonight!","&quot;Graverobber, graverobber, sometimes I wonder why I even bother..&quot; Have fun tonight!",سوپرایز
1752323566,Fanbase وشەیەکی کۆدە بۆ شتێکی زۆر تایبەت بۆ Anoop. زۆر کەسی..و تایبەت.,neutral,chrissy1785,@NoopDoggNatasha Fanbase is a code word for something very special to Anoop. Very personal..and special.,Fanbase is a code word for something very special to Anoop. Very personal..and special.,ئاسایی
1752350460,ئاه سناپ، کاتێکی خۆش بەسەر بەرە,fun,andieegarza,"@AlexAllTimeLow ohh snapp, have fun","ohh snapp, have fun",خۆشی
1752350559,تا پەنجەم لێت دا! #ستیکام,fun,vagabondblues,@littlemissgina I beat you to the punch!  #stickam,I beat you to the punch! #stickam,خۆشی
1752350603,ئەوەت لە کێ بیستووە؟ بەڵام ئەگەر ئەوە ڕاستە. من ڕاست دەکەم ئەو!!!,neutral,DavidCooksWife,@EAJosh Who did you hear that from?  But if thats true. I am right her!!!,Who did you hear that from? But if thats true. I am right her!!!,ئاسایی
1752350664,خۆشمدوێن,love,xJulianGray,@pakyton i love them,i love them,خۆشەویستی
1752350702,ئەوە تەنها سەیرە... :\ ئای، وە چی بوو کە تۆ بۆم دەکێشیت؟,worry,Shinigumi,"@schappie That's just weird... :\  Oh, and what was it you were drawing for me?","That's just weird... :\ Oh, and what was it you were drawing for me?",نیگەران
1752350816,باش! تۆ لە یانەی تویتەری 5 ژمارەیییت.,happiness,JoeCascio,@Merlene Cool! You're in the 5-figure-Tweeter Club.,Cool! You're in the 5-figure-Tweeter Club.,بەختەوەر
1752350845,ohh kayy fasho ئەگەر ئەمشەو بچیت کاتێکی خۆش بۆ من,worry,siimpLybeautii,@Yungrichhustla ohh kayy fasho if u go tonight have fun for me,ohh kayy fasho if u go tonight have fun for me,نیگەران
1752350849,بەڵێ- هەمان لێرەش. من دەبێت لە مەزاجدا بم 4 it.,worry,flyinfoxymama,@FlyAArmy Yep- same here. I have to be in the mood 4 it.,Yep- same here. I have to be in the mood 4 it.,نیگەران
1752350853,شەقامی شەیکداون!!!,neutral,AAronL1968,Shakedown Street!!!,Shakedown Street!!!,ئاسایی
1752350911,من میندیم خۆشدەوێت، ئەو کارمەندی دڵخوازی منە,love,Bigshoeboss,"I love Mindy, She is my favorite employee","I love Mindy, She is my favorite employee",خۆشەویستی
1752350918,من sowwy u دەبێت کار بکەیت w / گەمژەیەک. من پەیوەندیت پێوە دەکەم ئەگەر بتەوێت. تەنها بۆ ئەوەی ڕۆژەکەت بشکێنم.,worry,jenniab91,@Nora_78 I'm sowwy u have to work w/an idiot. I will call u if u want. Just to break up ur day.,I'm sowwy u have to work w/an idiot. I will call u if u want. Just to break up ur day.,نیگەران
1752350970,ساڵێکە سواری خۆڵ نەبووم. ڕقی لە تاکە تراکێکە، دەتوانێت مامەڵە لەگەڵ دوو تراکدا بکات، خاو.,neutral,kelownagurl,"@picsiechick I haven't ridden on dirt for a year. Hate single track, can handle double track, slow.","I haven't ridden on dirt for a year. Hate single track, can handle double track, slow.",ئاسایی
1752351016,ئێستا دەڕۆیت تا جێگاکە! گونایت جێسیکا,neutral,ellygirl12,goin ta bed now!   goodnite jessica,goin ta bed now! goodnite jessica,ئاسایی
1752351115,بەخۆشی!! ;),sadness,MAvilez3,@Aroundtheus  cheers!! ;),cheers!! ;),دڵتەنگ
1752351189,کاتی ئەوە هاتووە هەندێک Halo3 ئەوا؟,neutral,blackfish,@KrustyCanuck Time for some Halo3 then?,Time for some Halo3 then?,ئاسایی
1752351205,ڕۆژی دایکان پیرۆز بێت لە هەموو دایکانی دەرەوە...,love,jizzelle,happy mother's day to all moms out there...,happy mother's day to all moms out there...,خۆشەویستی
1752351299,من پێم وا نەبوو ڤیدەکە hoeish بوو من لە ڕاستیدا خۆشم دەوێت.it زۆر ناشرین بوو خخخخ,love,TheBajanVixen,@jusreenomas i didnt think the vid was hoeish i actually love it.it was so nasty  lol,i didnt think the vid was hoeish i actually love it.it was so nasty lol,خۆشەویستی
1752351341,کاتێکی خۆش بەسەر بەرە لەسەر گردێکی خۆراکپێدراو,happiness,rosalmao,@HilHolla have fun on flashy fed hill..im sure you're imported cheeto eating ass will fit in lol,have fun on flashy fed hill..im sure you're imported cheeto eating ass will fit in lol,بەختەوەر
1752351384,سوپاس joeman!,love,elizabethelder,@Quizman15 thanks joeman!,thanks joeman!,خۆشەویستی
1752351474,رۆژێكى سەرنج راكێش!,neutral,Kaylasheckler15,Amazing day!,Amazing day!,ئاسایی
1752351488,ئاشۆتن زۆر جوان دەردەکەوێت، تۆش وەک هەمیشە خەیاڵی دەردەکەویت! ئێوە دوو کەس هێشتا درەوشانەوەی تازە هاوسەرگیریان هەیە و ئەوەش بۆ هەمیشە. خۆشەویستی ڕاستەقینە,love,Azleeshy,"@mrskutcher Ashotn looks great, and you look fantastic as always! You two still have the newlywed glow, and that's forever.  TRUE LOVE","Ashotn looks great, and you look fantastic as always! You two still have the newlywed glow, and that's forever. TRUE LOVE",خۆشەویستی
1752351548,من حەزم لە کراسەکانی HR ی ئێوەیە. ئەوان ئیلهامم دەدەن بۆ بیرکردنەوە لە وتەی ژیرانە/ئەدەبی هاوشێوەی HR کە لە ڕاستیدا هەرگیز لەبەرم نەدەکرد.,love,HollyMVG,@beneubanks I like your HR shirts. They're inspiring me to think of witty/rude HR-like sayings I'd never actually wear.,I like your HR shirts. They're inspiring me to think of witty/rude HR-like sayings I'd never actually wear.,خۆشەویستی
1752351564,سەیر نییە ئێمە هاوسەرگیریمان کردووە. خۆشەویستی شەوانە. &lt;3,love,hermorrine,@hxcfairy No wonder we're married.   Night love. &lt;3,No wonder we're married. Night love. &lt;3,خۆشەویستی
1752351566,سلاو لە هەمووتان! تازە یەکەم سینگڵم میکس کرد....! &quot;بۆچی R U&quot; ...من زۆر پەرۆشم!,happiness,nairda17,@freshalina @itsmeAmerie Hey everyone! I just mixed the first single....!  &quot;Why R U&quot; ...I'm sooo excited!,Hey everyone! I just mixed the first single....! &quot;Why R U&quot; ...I'm sooo excited!,بەختەوەر
1752351588,لێێێێێدا!!! زۆر دڵخۆشم کە توانیت ئەو کچە بناسیت!,happiness,nickiraegeous,@kimberlynicole Yay!!! I'm so happy you got to meet her!,Yay!!! I'm so happy you got to meet her!,بەختەوەر
1752351621,چوون بۆ سەر جێگا cuz من دەبێت هەستم لە وەک حەوت سی یان شتێک سبەی. ئەمڕۆ لە ڕاستیدا ئەوەندە خراپ نەبوو لە ڕۆژێکدا.,neutral,heytheredeahna,going to bed cuz i have to get up at like seven thirty or something tomorrow. today was actually not that bad of a day.,going to bed cuz i have to get up at like seven thirty or something tomorrow. today was actually not that bad of a day.,ئاسایی
1752351655,مەگەر مەبەستت ئەو ٢ کاتژمێرە بێت لە هەفتەیەکدا کە بۆ خەوتن بەکاری دەهێنم. بەڵێ، گریمان دەتوانم ئەوانە بەکاربهێنم,worry,Yellow_Dog,"@lindentreephoto Unless you mean the 2 hours a week i use for sleeping. Yeah, suppose i could use those","Unless you mean the 2 hours a week i use for sleeping. Yeah, suppose i could use those",نیگەران
1752351734,دەچمە سەر جێگا، بەڵام دەبێت بڵێم زۆرم خۆشدەوێت کە #justin timberlake و #mark martin بابەتەکانی #3 و #4 ترێند لە تویتەر تۆنیت! بەرد.,love,Allyrockr,"goin to bed, but must say i love that #justin timberlake and #mark martin are the #3 and #4 trending topics on twitter tonite!  rock.","goin to bed, but must say i love that #justin timberlake and #mark martin are the #3 and #4 trending topics on twitter tonite! rock.",خۆشەویستی
1752351767,لە homee..بێزارکەر بەڵام okiee ی دەبێت سبەی خۆشەویستەکەی و دایکی ببینێت بۆ momma dayy,love,Franccinee,at homee..boring but its okiee gonna see the boyfriend and his momma tomorrow for momma dayy,at homee..boring but its okiee gonna see the boyfriend and his momma tomorrow for momma dayy,خۆشەویستی
1752351821,باسی چ خۆشییەک دەکەیت؟,fun,JillPerson,@WeddingTresses what fun are you speaking of?,what fun are you speaking of?,خۆشی
1752351830,دڵنیابە کە پەیوەندی بە yur دایکەوە دەکەیت &amp; پێی بڵێ چەندە خۆشت دەوێت. پێی بڵێ خۆشم دەوێیت بۆ ئەوەی تۆ هێنایە ناو جیهان.,neutral,GericaQuinn,@TravisGarland make sure you call yur mother &amp; tell her how much you love her. Tell her I love her for bringin you into the world.,make sure you call yur mother &amp; tell her how much you love her. Tell her I love her for bringin you into the world.,ئاسایی
1752351863,چوون بۆ سه‌ر جێگه‌ی خه‌وتن. ئەمڕۆ ڕۆژێکی باشی دیکە بوو، ئەگەر بێ ڕووداویش بێت.,neutral,wolstenclark,"Going to bed. Today was another good, if uneventful day.","Going to bed. Today was another good, if uneventful day.",ئاسایی
1752352109,دەنگێکی خۆشە بۆ من! تایلۆر + کێلی لە گەشتێکدا پێکەوە تەنها ژیرییەکی پاکە!,fun,ShanDonn,@jefferycjordan Sounds good to me!  Taylor + Kellie on tour together is just pure genious!,Sounds good to me! Taylor + Kellie on tour together is just pure genious!,خۆشی
1752352157,من بڕیارم داوە بە دەوری ماڵەکەمدا خۆم بخزێنم و ساندویچی هێلکە بخۆم. و چەند قاپێک جگەرە بکێشە. بۆ من وەک ئێوارەیەکی نایاب دەنگ دەدات,relief,comiendoteresa,im determined to slarm around my house and eat egg sandwiches. and smoke a few bowls. sounds like a splendid evening to me,im determined to slarm around my house and eat egg sandwiches. and smoke a few bowls. sounds like a splendid evening to me,ئارام
1752352162,هاها من خۆشم دەوێت Dnt Regret It Now لەگەڵ Tyga &lt;3 بەڵام تەنها بە شێوەیەکی هەڕەمەکی، DeLeon گۆرانی دەڵێت لەسەر Tifanny Blews! هاها وەک یەک دێڕ.. XD,happiness,Galiiit,"@XKirstyxo haha  I love Dnt Regret It Now with Tyga &lt;3 But just randomly, DeLeon sings on Tifanny Blews! Haha like one line.. XD","haha I love Dnt Regret It Now with Tyga &lt;3 But just randomly, DeLeon sings on Tifanny Blews! Haha like one line.. XD",بەختەوەر
1752352258,LOVE ئەلبوومەکە کوڕان و ناتوانن چاوەڕێی بڵاوکردنەوەی فەرمی تەنها کنجکاو، چ top 3 softsynths / DAW بەکارهێنرا لەسەری؟,love,jac3k,"@crystalmethod LOVE the album guys and can't wait for the official release  Just curious, what top 3 softsynths/DAW were used on it?","LOVE the album guys and can't wait for the official release Just curious, what top 3 softsynths/DAW were used on it?",خۆشەویستی
1752352280,تاکە شتێک کە من لەبارەی ستار ترێکەوە دەیزانم گاڵتەجاڕییەکەی تویتەرەکەی tina fey ە، &quot;با چوارەم لەگەڵتان بێت&quot;,happiness,nickbeaver,"@ultraviolet10 the only thing I know about star trek is the joke from tina fey's twitter, &quot;may the 4th be with you&quot;","the only thing I know about star trek is the joke from tina fey's twitter, &quot;may the 4th be with you&quot;",بەختەوەر
1752352348,چ شەوێکی نایاب بوو.,happiness,herNewObsession,What a great night.,What a great night.,بەختەوەر
1752352359,HaHa i Forgot...پێدەچێت لە Youtube بێت...بۆیە دواتر سەیری دەکەم,enthusiasm,pawsthejaws,@J14magazine HaHa i Forgot...It'll Probably Be On Youtube...So I'll Watch It Later,HaHa i Forgot...It'll Probably Be On Youtube...So I'll Watch It Later,پەرۆش
1752352375,تۆ greeeeeeaaaaattttttt بوویت بەیب!! سه‌رسوڕهێنه‌ره‌!,love,CaraeH,@PrincessSuperC you were greeeeeeaaaaatttttttt babe!! It was amazing!,you were greeeeeeaaaaatttttttt babe!! It was amazing!,خۆشەویستی
1752352381,http://twitpic.com/4wgoi - لە پاسدا کوڕان و شاعیران داواکردنی مێدیچی و پودینگی نانێکی مۆزی شوکولاتەی سپی,happiness,LadyLeeT,http://twitpic.com/4wgoi - At bus boys and poets ordering medici and white chocolate banana bread pudding @kspidel!!,http://twitpic.com/4wgoi - At bus boys and poets ordering medici and white chocolate banana bread pudding,بەختەوەر
