tweet_id,kurdish_tweets,sentiment,author,content,tweets,kurdish_sentiments
1962390479,من ئامێری ئیسپرێسۆم دەوێت,worry,Jotacon,@vronmcintyre I want an espresso machine,I want an espresso machine,نیگەران
1962390792,من داوای لێبوردن دەکەم.,worry,imhappy1966,@HighRawFoods I am sorry.,I am sorry.,نیگەران
1962391061,دیدۆ &quot;US 2 خوداوەندە بچووکەکان&quot; http://ow.ly/9UIn &quot;تەنها ئەم ساتە/ با هەموو شتێک لێرە بوەستێت/ من تێر بووم&quot;...وشەیەک کە وات لێدەکات تووشی شۆک ببیت...,hate,Aloft_Incumbent,DIDO &quot;US 2 Little Gods&quot; http://ow.ly/9UIn &quot;Just this moment/ Let it all stop here/ I've had my fill&quot;...words that make you panic...,DIDO &quot;US 2 Little Gods&quot; http://ow.ly/9UIn &quot;Just this moment/ Let it all stop here/ I've had my fill&quot;...words that make you panic...,ڕق
1962391127,ermm، زیاتر لە نیوەی سەرەوەی ڕەشی تەواو دەچێت. و هەندێکیان خۆڵەمێشی تەواو,neutral,JoshSemans,"@catashton ermm, more like a full black upper half.  and some a completley grey","ermm, more like a full black upper half. and some a completley grey",ئاسایی
1962391823,بەڵێ بەهیچ شێوەیەک هەست بە هیچ شتێک دەکەیت؟ بیرم هاتەوە کە سەیری لۆپتم دەکرد لە مۆبایلەکەیدا و ئەو نیگایە کۆکە بوو,neutral,SylvieSOfasho,@Nigganelle yeah do you feel anything at all? I remembered I was looking at loopt on his phone and that nigga was coughin all over that,yeah do you feel anything at all? I remembered I was looking at loopt on his phone and that nigga was coughin all over that,ئاسایی
1962391924,سوپاس بۆ ur gnite و... *سوپاس* بۆ ur photo of sims 3... دڵ لێرە شکاوە,worry,leehong2511,@bernadinee thank for ur gnite and... *thank* for ur photo of sims 3... heart broken here,thank for ur gnite and... *thank* for ur photo of sims 3... heart broken here,نیگەران
1962392072,سڵاو! زۆر خۆشحاڵم کە هەینییە بەڵام دڵخۆش نەبووم کە تەنها سێوێکی خراپم خواردووە,happiness,sarisam,@detrick Hey! So glad it's Friday but not happy that I just ate a bad apple,Hey! So glad it's Friday but not happy that I just ate a bad apple,بەختەوەر
1962392145,مانگی نوێ تەواو بوو! ووو! ئێستا من ئەوی داهاتووم دەوێت...,happiness,KeelHaulKate,Finished new moon! Woo! Now i want the next one...,Finished new moon! Woo! Now i want the next one...,بەختەوەر
1962392290,دانیشتووم لە باخچە لەگەڵ مۆمیاکەم و هەروەها دەقێکم لە کوڕەکە وەرگرت کە پێموابوو GOT THE HINT دیارە نەبوو.,happiness,Jovi_Jonas,Been sitting in garden with my mummy and also got a text from the boy who i thought had GOT THE HINT    obviously not.,Been sitting in garden with my mummy and also got a text from the boy who i thought had GOT THE HINT obviously not.,بەختەوەر
1962392455,دەبینین کرێگ ڕەنگە تەنها hog u guys! هاها من بەهەر حاڵ ئەمشەو تا کاتژمێر ١٠ کار دەکەم,worry,makkmommy,@bcran we'll see Craig might just hog u guys! haha I work till 10 tonight anyways,we'll see Craig might just hog u guys! haha I work till 10 tonight anyways,نیگەران
1962392850,دانی لوولە جوانەکانی بڕی,neutral,cbldivas,Danny cut his beautiful curls,Danny cut his beautiful curls,ئاسایی
1962393224,تەنها نیوەی ستافی RROم بینی کە بەلایدا تێپەڕین...بەداخەوە نەمبینی یان...,worry,linnix,Just saw half the RRO staff walk by...sadly I didn't see @legmar or @mtacheme,Just saw half the RRO staff walk by...sadly I didn't see or,نیگەران
1962393556,نزیکە لە کاتی نانخواردنی نیوەڕۆ بۆ تۆ,neutral,bonfire1980,its almost lunch time for you,its almost lunch time for you,ئاسایی
1962393606,ئیم دڵتەنگم لە ئێستادا becuz لە خانمەکەم,sadness,SE_nicorob,Im sad right now becuz of my lady,Im sad right now becuz of my lady,دڵتەنگ
1962393907,http://bit.ly/NYhMZ دیۆنوسیا وای لێکردم ئەو کارە بکەم,happiness,revqueer,http://bit.ly/NYhMZ  Dionusia made me do it,http://bit.ly/NYhMZ Dionusia made me do it,بەختەوەر
1962394372,دەیەوێت بچێتە لۆنۆڤالا بۆ هاوسەرگیری frenz....bt....هیچ گواستنەوە arrngmnts wrkg دەرەوە,sadness,thoughtspeaks,wants to goto lonovala for frenz wedding....bt....no transport arrngmnts wrkg out,wants to goto lonovala for frenz wedding....bt....no transport arrngmnts wrkg out,دڵتەنگ
1962394759,کاتی جێهێشتنی یاداشتێکی شەڕانگێزی پاسیڤ بۆ خاوەنەکانی. خەتای سەگەکە نییە... ئەوە خاوەن گەوادەکانیانن,worry,kizat,@niftybitch time to leave a passive agressive note to the owners.  It's not the dog's fault... it's their shitty owners,time to leave a passive agressive note to the owners. It's not the dog's fault... it's their shitty owners,نیگەران
1962395916,بۆ ماوەی ٤ ڕۆژ تەنیا دەبێت چونکە لە باگیۆ دەبێت. http://plurk.com/p/x2apl,sadness,zialozadalim,will be lonely for 4 days because @trizia will be in baguio.   http://plurk.com/p/x2apl,will be lonely for 4 days because will be in baguio. http://plurk.com/p/x2apl,دڵتەنگ
1962396056,یۆلۆندا، من بە مۆبایلەکەمەوە چوومە مەلەکردن لە کەنار دەریا خخخخ و بۆیە هەموو پەیوەندییەکانم لەدەستدا,surprise,aprilhrrn,"Yolonda, I went swimming with my phone at the beach lol and so I lost all my contacts","Yolonda, I went swimming with my phone at the beach lol and so I lost all my contacts",سوپرایز
1962396469,ئەوە هیچ بوینۆ نییە...هیوادارم هەست بە باشتر بوون بکەیت!,worry,musicaddikt787,@chantelmybell  that's no bueno...hope u feel better!,that's no bueno...hope u feel better!,نیگەران
1962396607,بۆیە....من پێشبینی دەکەم هیچ BGN؟,surprise,Rockaholica,so....i'm guessing no BGN?,so....i'm guessing no BGN?,سوپرایز
1962397028,هەستکردن وەکو چەقۆی ئەم پاشەکشەیە. هەوڵ مەدە پەیوەندیم پێوە بکەیت و نامەم بۆ بنێرە.,worry,HoodTREdemark,Feeling like the bum of this recession.  Don't try to call or text me.,Feeling like the bum of this recession. Don't try to call or text me.,نیگەران
1962397048,هەستت پێ ئەکەم,relief,MCRmuffin,@Boy_Kill_Boy I know the feeling,I know the feeling,ئارام
1962397347,مەبەستم ئەوەیە کەسێک بە ئۆتۆمبێلێک سەگێکی لێداوە. تەنها لەوێ کەوتبوو,worry,kriisco,@XxMolliexX I mean someone hit a dog with a car. It was just laying there,I mean someone hit a dog with a car. It was just laying there,نیگەران
1962397631,خۆشە لە کۆبوونەوەی بازرگانی دەربچیت هەست بە ئارەزووی دەکەیت &amp; بەهادار. ئێستا، بۆ ئەوەی لە ڕێکەوتێکی ئاوا بێیتە دەرەوە..! (یان، بۆ ئەوەی بەهیچ شێوەیەک بچیتە سەر ڕێکەوت..),worry,encaf1,"Nice to come out of a business meeting feeling desired &amp; valuable. Now, to come out of a date like that..! (Or, to go on a date at all..)","Nice to come out of a business meeting feeling desired &amp; valuable. Now, to come out of a date like that..! (Or, to go on a date at all..)",نیگەران
1962397669,هاها نەخێر ئەو دۆڵە نییە. ئەوە دۆڵی فێنک و سارد و سڕە. دۆڵی تەکساس. وەک...دۆڵی ڕیۆ گراندە. ئاههاها خۆزگە لە دۆڵی کالیفۆرنیا بژیام,relief,enaaarz,@te0h hahah no not that valley. that's cool valley. texas valley. like...rio grande valley. ahhaha i wish i lived in california valley,hahah no not that valley. that's cool valley. texas valley. like...rio grande valley. ahhaha i wish i lived in california valley,ئارام
1962397979,زۆر بۆ کڕینی ئەو مۆبایلە نوێیە سەرسوڕهێنەرە لە سۆنی ئێریکسۆن - من ئێستا بێریم حەزم لە هەموو کەسێکی ترە...,happiness,candz,So much for buying that awesome new phone from sony ericsson  - I am now Berry'd like everyone else...,So much for buying that awesome new phone from sony ericsson - I am now Berry'd like everyone else...,بەختەوەر
1962398157,تازە پەیوەندییە ترسناکەکەی لە چاودێری منداڵەوە وەرگرتووە - H بچووکەکە سەری لێداوە سیتەر دەڵێت باشە و هێلکەی قاز بە خێرایی دەچێتە خوارەوە,enthusiasm,MaternalSpark,just got the dreaded call from babysitter - little H has bumped her head  Sitter says she's fine and goose egg is going down fast,just got the dreaded call from babysitter - little H has bumped her head Sitter says she's fine and goose egg is going down fast,پەرۆش
1962402603,boo (بەڵام ئایا گوێ دەگرم؟),neutral,rainbowirisfarm,boo (but will I listen?),boo (but will I listen?),ئاسایی
1962402690,گۆش، ببورە کاکە. هیوای مژدەی خۆش دەخوازم.,worry,joshigginbotham,"@jaymckenney gosh, I'm sorry man.  I'll hope for good news.","gosh, I'm sorry man. I'll hope for good news.",نیگەران
1962402965,هەوڵدان بۆ ئەوەی بە گەشبینییەوە بمێنمەوە لەکاتێکدا چاوەڕێی ئەوەم کلیلەکانم لە ئۆتۆمبێلە قوفڵکراوەکەم دەربهێنم,worry,blueyedgrl44,Trying to stay upbeat while I wait to get my keys out of my locked car,Trying to stay upbeat while I wait to get my keys out of my locked car,نیگەران
1962403118,دەمەوێت بارانەکە بڕوات! لەم دواییانەدا زۆر بووە,neutral,WildestDream,I want the rain to go away! There has been too much of it lately,I want the rain to go away! There has been too much of it lately,ئاسایی
1962403289,aww im sorry im home now هیوادارم باش بێت من خۆشم دەوێی wifey &lt;3 xx,sadness,Miss_Foxay,@CaroTheNyx aww im sorry im home now hope your ok  i love ya wifey &lt;3 xx,aww im sorry im home now hope your ok i love ya wifey &lt;3 xx,دڵتەنگ
1962403627,ئەمەش خەریکە دەمارەکانم دەچێتە سەر. من ناتوانم وێنەکەم بگۆڕم,hate,WhitneyShi,This is getting on my nerves. I cant change my pic,This is getting on my nerves. I cant change my pic,ڕق
1962403675,ڕاکردن بە شاردا لەگەڵ کاثلین....ئەو بۆ ماوەی مانگێک جێم دەهێڵێت..,sadness,mgstrawn,Running around town with Kathleen....she's leaving me for a month..,Running around town with Kathleen....she's leaving me for a month..,دڵتەنگ
1962403695,فۆڕمی بیمەی بۆ پۆلۆ وەرگرت. کەمێک هەست بکە دەبێت ئەنجام بدرێت هەرچەندە.,worry,ramdomthoughts,Got insurance forms for Polo. Feel a bit  Has to be done though.,Got insurance forms for Polo. Feel a bit Has to be done though.,نیگەران
1962403796,خۆزگە ئێمە دا نەدەخستایە,worry,Toni_GPB,@mommypages I wish our @COSICols didn't close,I wish our didn't close,نیگەران
1962404255,واو، جۆرێک بێزار بووم کە جۆن ئێستا وەبەرهێنان دەکات. دیارە بەردەوام لە کاتەکاندا دەگێڕدرێتەوە، بەڵام پارەدانەکان زۆر قورسن بۆ من,boredom,oldparty,"Wow, kinda bothered that Jon is doing deposits now.  Apparently he keeps getting fucked out of times, but deposits are SO hard for me","Wow, kinda bothered that Jon is doing deposits now. Apparently he keeps getting fucked out of times, but deposits are SO hard for me",بێزار
1962404379,تەنها گەیشتمە ماڵەوە لە ئەنجامدانی دوکانە گەورەکە بە تەواوی munched دەرەوە چونکە من زۆر برسی بووم و من لە کێش لە بەیانیان ئۆپ,worry,kelanjo19,just got home from doing the big shop totally munched out because i was so starving and im at weigh in in the morning oops,just got home from doing the big shop totally munched out because i was so starving and im at weigh in in the morning oops,نیگەران
1962404738,مەحاڵە بە تەواوی سەیری هەر ڤیدیۆیەکی فلاش بکەم لەگەڵ ماکەکەم دوای 5.7,sadness,savvasmalamas,its impossible to watch in full ANY flash video with my mac after 5.7,its impossible to watch in full ANY flash video with my mac after 5.7,دڵتەنگ
1962404828,وەها.ئە.گاڵتەکردن.,happiness,lacitygrl8,such.a.tease.,such.a.tease.,بەختەوەر
1962404869,بەڕاستی نەخۆشە دیسانەوە ٢ هەفتەیە باش نەبووم، هەوکردنی ڤایرۆسی خراپم هەیە.,worry,Betheglintine,"really ill again not been well for 2 weeks, i've got a bad viral infection.","really ill again not been well for 2 weeks, i've got a bad viral infection.",نیگەران
1962405180,من سەگێک یان پشیلەیەک یان شتێکم دەوێت کە شتێکم دەوێت بەبێ مەرج خۆشم بوێت، thats نەک ماددی یان memeber خێزان,neutral,PrincessSakura,"i want a dog or a cat or something  i want something to unconditonally love, thats not materialistic or a family memeber","i want a dog or a cat or something i want something to unconditonally love, thats not materialistic or a family memeber",ئاسایی
1962405797,دۆلهاوس ڕزگاری بوو!!! گەڕانەوەی بۆ وەرزێکی تر!!! زۆر خراپە سکرابەکان وا نییە,happiness,HollieTennan,Dollhouse was saved!!! Its coming back for another season!!! Too bad scrubs isn't,Dollhouse was saved!!! Its coming back for another season!!! Too bad scrubs isn't,بەختەوەر
1962406657,زۆر حەزی لە بەکارهێنانی دەستگەیشتن لە دوورەوە بۆ بەکارهێنانی ڕیزبەندیەکەم لە لاپتۆپەکەمەوە. -- گەڕانەوە لە ئیمێرج جارێکی تر.,love,DaniFaubert,Loves using remote access to use my desktop from my laptop.  -- Back from Emerge once again.,Loves using remote access to use my desktop from my laptop. -- Back from Emerge once again.,خۆشەویستی
1962406888,چوونە tmobile پێویستم بە مۆبایلێکی نوێیە ئەم G1 یە بۆیە ئیتر بۆ من کارناکات,worry,RoxieDaRockstar,Going to tmobile  i need a new phone this G1 is so not working for me anymore,Going to tmobile i need a new phone this G1 is so not working for me anymore,نیگەران
1962407012,پشیلە هەژارەکان ئەگەر هیچ شتێک نەبێت کە بتوانرێت بکرێت، هیوادارم لانیکەم بتوانیت ماڵێکی باشی بۆ بدۆزیتەوە,neutral,Nymeth,"@renay Poor kitties  If there's nothing that can be done, hopefully you'll at least be able to find her a good home","Poor kitties If there's nothing that can be done, hopefully you'll at least be able to find her a good home",ئاسایی
1962407149,نەخێر wayyy، ئەوە زۆر پێکەنیناوییە. باشە ئەو دڵنیایە لەدەست دەدات، بەڵام لەوەتەی تۆ ڕۆیشتیت، هەست دەکەم منیش زۆرم کەی سەردانی داهاتووت؟,love,tarek_,"@ChristinaHz no wayyy, that's too funny.  well he sure is missing out, but ever since you left, i feel i am too  when is your next visit?","no wayyy, that's too funny. well he sure is missing out, but ever since you left, i feel i am too when is your next visit?",خۆشەویستی
1962407156,وا لێم مەکە لێت بدەم! و بەڵێ بەڵێ بەڕاستی دەیکات. هیچ کیوتێک بۆ من نییە,neutral,draykonis,@dysonrules don't make me smite you! and yeah @micolerose yeah it really does. No cuties for me,don't make me smite you! and yeah yeah it really does. No cuties for me,ئاسایی
1962407600,دەزانم، من لە لیستەکەدا بووم، بەڵام ناچار بووم لەدەست بدەم b/c پلانە ناکۆکەکان چۆن بوو؟,sadness,jamiefishback,"@TeelaJBrown i know, i was on the list, but had to miss out b/c of conflicting plans  how did it go?","i know, i was on the list, but had to miss out b/c of conflicting plans how did it go?",دڵتەنگ
1962408126,grumble..کەش و هەوا پیاو.. نازانم wtf ئەوان باسی دەکەن.,boredom,brendablue43,grumble..weather man.. don't know wtf they are talkin about.,grumble..weather man.. don't know wtf they are talkin about.,بێزار
1962408417,بە شێوەیەکی ناباوەر نیگەرانە لە ستانلی...,worry,FatsoTheWombat,is incredibly worried about Stanley...,is incredibly worried about Stanley...,نیگەران
1962408442,کاتژمێرێک ڕۆیشتن لە کەشوهەوای گەرمدا = نێلییەکی ڕازی بەڵام ئازاربەخش. ئۆو، تاڵە مووەکان.,relief,bleedthemelody,"An hour of walking in hot weather = a satisfied but hurting Nellie.  Ow, blisters.","An hour of walking in hot weather = a satisfied but hurting Nellie. Ow, blisters.",ئارام
1962408505,ڕیخۆڵەی خۆت لە hollyoaks xx,neutral,charl598,@Emz2009 gutted your out off hollyoaks  xx,gutted your out off hollyoaks xx,ئاسایی
1962408575,ها ها...تازە کۆکتێلێکی نوێم دۆزیەوە: سەما لەگەڵ وێنچەکان (شەربەتی قڕنابیت، ڕومی بەهاراتدار)، دەنگێکی خۆشە بەڵام من هیچ شەربەتی قڕنابیتم نییە,surprise,lepouse,"ha ha...just found a new cocktail: Dances with Wenches (Cranberry Juice, Spiced Rum), sounds nice but I don't have any cranberry juice","ha ha...just found a new cocktail: Dances with Wenches (Cranberry Juice, Spiced Rum), sounds nice but I don't have any cranberry juice",سوپرایز
1962408705,من thnk ima گریان هەست بە rlly خراپ,worry,lilmizzketa,i thnk ima cry i feel rlly bad,i thnk ima cry i feel rlly bad,نیگەران
1962408814,ok its FF soooo بۆچی کەس فۆڵۆوی MEEEE ناکات؟؟؟ خخخ ughhhh من هەندێک تەمبەڵی a%# فۆڵۆوەرم هەیە ئەوان تەنانەت یارمەتیم نادەن,neutral,FlyGirlMeMe,ok its FF soooo why isn't anyone following MEEEE??? LOL ughhhh I have some lazy a%# followers they wont even help me out,ok its FF soooo why isn't anyone following MEEEE??? LOL ughhhh I have some lazy a%# followers they wont even help me out,ئاسایی
1962409059,سەیرکردنی ئەڵقەی کۆتایی کوڕان پێش گوڵ,sadness,inditapasti,watching the final episode of boys before flowers,watching the final episode of boys before flowers,دڵتەنگ
1962409435,سڵاو ئێوە دەبێ بانگهێشتم بکەن بۆ دەرەوە...موودی تاکە هاوڕێمە لەم ڕۆژانەدا,surprise,brizziebaby,@ashmohazel @immackmaine @its_erincharde @brando2711 hey you guys should invite me out...moody is my only friend these days,hey you guys should invite me out...moody is my only friend these days,سوپرایز
1962409646,من لە ڕۆژی ئازادیمدا بە دیل دەگیرێم.,love,RanaJ,I'm being held captive on my day of freedom.,I'm being held captive on my day of freedom.,خۆشەویستی
1962410227,سڵاو #socialmediatv ugh هیچ ڕێگەیەک نییە بۆ ئەنجامدانی ڤیدیۆ&gt;blah {pouts} (سۆشیال میدیا تیڤی ڕاستەوخۆ &gt; http://ustre.am/2NjV),sadness,AbesWreck,Hey #socialmediatv ugh no way to do video&gt;blah {pouts}   (Social Media TV live &gt; http://ustre.am/2NjV),Hey #socialmediatv ugh no way to do video&gt;blah {pouts} (Social Media TV live &gt; http://ustre.am/2NjV),دڵتەنگ
1962410294,پەمپ دەکرێت و bummed هەمووی لە یەک کاتدا.......,sadness,InternDerek,is pumped and bummed all at the same time.......,is pumped and bummed all at the same time.......,دڵتەنگ
1962410357,لە 1st وتیان بەڵێ بەڵام وا دیارە ئەو پلانەیان خراپ کردووە b/c of ​​the supply demand,neutral,WhatsTheT,at 1st they said yes but it looks like they scratched that plan b/c of the supply demand  @travoloso,at 1st they said yes but it looks like they scratched that plan b/c of the supply demand,ئاسایی
1962410358,ئەمشەو کۆتا شەوی جەی لینۆ!!! وەک منداڵێکی ساوا دەگریم!!,sadness,AmeenaS,Tonight the last night of Jay Leno!!!  am gonna cry like a baby!!,Tonight the last night of Jay Leno!!! am gonna cry like a baby!!,دڵتەنگ
1962410509,نابێت بە شێوەیەکی سەیر لە کۆمپیوتەرەکەدا دابنیشێت، دەزانم Im دەچێتە سەر سەقفەکە جارێک کە هەستامەوە,enthusiasm,LittleMissDx,"Shouldn't sit weirdly at the pc, I know Im going to hit the deck once I get up","Shouldn't sit weirdly at the pc, I know Im going to hit the deck once I get up",پەرۆش
1962410689,کەسێکی ون بووە.. های.. http://plurk.com/p/x2avn,worry,projectdennio,is missing someone.. haayy..  http://plurk.com/p/x2avn,is missing someone.. haayy.. http://plurk.com/p/x2avn,نیگەران
1962410731,تکایە ئەو لینکانەی یوتیوبم بۆ بنێرن، ئێرین سەیری زۆربەیان دەکرد بەڵام من خواردنم دروست دەکرد و نەمتوانی کاوبۆیەکان ببینم,neutral,savedforlater,"@MischievousMel Please send me those youtube links, Erin watched most of them but I was cooking and didn't get to see the cowboys","Please send me those youtube links, Erin watched most of them but I was cooking and didn't get to see the cowboys",ئاسایی
1962410871,هاها، تا ئەو کاتەی دەگەڕێتەوە گەورە دەبێت. پێت بڵێ چی .. ئێمە یوم! ڤانکۆڤەر هەندێک شوێنی مەلای بەم زووانە، یان تەنها بڕۆ هیندی,happiness,jeremylim,"@fishieee Haha, it'll be gross by the time it comes back.    Tell you what .. we'll Yum! Vancouver some malay spot soon, or just go indian","Haha, it'll be gross by the time it comes back. Tell you what .. we'll Yum! Vancouver some malay spot soon, or just go indian",بەختەوەر
1962410962,هەرگیز. smh، من خاوەنی فلات نیم خخخخ,neutral,SamJones7,"@HottSnowflake never.  smh, I don't own flats  lol","never. smh, I don't own flats lol",ئاسایی
1962411200,ناوەڕۆکی ناوەڕۆک ناوەڕۆک .... gah! چیرۆکی ژیانم لە ئێستادا - thx بۆ بیرخستنەوەم. ئەوە ئەوەیە کە من دەبێ بیکەم v. Tweeting,neutral,shellykramer,@grentone Content content content .... gah! Story of my life right now - thx for reminding me. That's what I should be doing v. Tweeting,Content content content .... gah! Story of my life right now - thx for reminding me. That's what I should be doing v. Tweeting,ئاسایی
1962411327,من dnt دەگەم بە بچم یاری لەیزەرتاگ w / besties من! *پیر من مردووم و ڕۆشتم*,surprise,clashley21,I dnt get to go play lasertag w/ my besties!     *old me's dead and gone*,I dnt get to go play lasertag w/ my besties! *old me's dead and gone*,سوپرایز
1962411496,مەساجێکم دەوێت!!!,happiness,goolia024,@lancearmstrong I want a massage!!!,I want a massage!!!,بەختەوەر
1962411704,خوێناوی خۆر سووتاوە,worry,Samb555970,Bloody sunburned,Bloody sunburned,نیگەران
1962411952,// هەست بە ئازارەکانت دەکەم. جارێک لە ئاپتێکدا بۆ ماوەی ٦ مانگ ژیام کە کرێچی پێشوو ٤ پشیلەی هەبوو. سووتانی چاو/سییەکان توند = گرێگ,sadness,gregghart,@jclayville // i feel your pain. i once lived in an apt for 6 mos where the previous tenant had 4 cats. burning eyes/tight lungs =  gregg,// i feel your pain. i once lived in an apt for 6 mos where the previous tenant had 4 cats. burning eyes/tight lungs = gregg,دڵتەنگ
1962412243,#twpp ..هێشتا nw لە بابەتەکانی ترێنددا..,neutral,ucannotreach,#twpp ..still nw in trending topics..,#twpp ..still nw in trending topics..,ئاسایی
1962412506,من یارمەتی نوێنەرایەتی ئەکتەرە بەرزەکان دەدەم بۆ کارەکانیان لە تیڤی/فیلم/شانۆ بۆیە تیکس بەخۆڕایی بەدەست بهێنە.. بەڵام بۆ کوڕانی جێرسی نا..,surprise,Alex_Segal,@fletchernet i help represent high profile actors for their tv/film/theatre careers so get free tix.. but not for Jersey Boys..,i help represent high profile actors for their tv/film/theatre careers so get free tix.. but not for Jersey Boys..,سوپرایز
1962412787,مناڵم لە کوێ بوویت؟ بیرت دەکەم، چەند ڕۆژێکە msnedمان نەکردووە!,sadness,SunkenTreasure6,"@dan87 where have you been, child? i miss you, we haven't msned in days!","where have you been, child? i miss you, we haven't msned in days!",دڵتەنگ
