tweet_id,kurdish_tweets,sentiment,author,content,tweets,kurdish_sentiments
1752053720,لە مۆڵی تۆ,neutral,mcnugget26,at thee mall,at thee mall,ئاسایی
1752053758,بڕۆ بۆ ناوەڕاستی دۆڵی لا مەمک هاها! never mind la، من نامەوێت لەگەڵت بچم بەهەر حاڵ,happiness,Tmaisarah,"@HannaHassan go to mid valley la boobs  haha! never mind la, i don't wanna go with you anyways","go to mid valley la boobs haha! never mind la, i don't wanna go with you anyways",بەختەوەر
1752053771,سوشی دوو شەو لەسەر یەک ئایا ئەوە هەڵە نییە وایە؟,worry,BuddyDave,Sushi two nights in a row isn't THAT wrong is it?,Sushi two nights in a row isn't THAT wrong is it?,نیگەران
1752053783,بەرەو ناوەندی شار دەڕۆین! خواردنەوە و سەما!!,happiness,trishj22,Heading downtown! Drinks and dancing!!,Heading downtown! Drinks and dancing!!,بەختەوەر
1752053785,نەفرەتتان لێ بکەن، دانیشتوانی ئیگلۆ!!,sadness,davemark,"@n_dubbs curse you, igloo dwellers!!","curse you, igloo dwellers!!",دڵتەنگ
1752053792,سوپاس بۆ زیادکردنی من، خۆشحاڵم کە تۆم هەبوو,surprise,OneFlipsta,"@alekandsteph thanks for adding me, glad to have you","thanks for adding me, glad to have you",سوپرایز
1752053896,http://twitpic.com/4wdui - ئەو زۆر جەژنانە نییە' ئەو هێهێ,happiness,FlyygirlKali,http://twitpic.com/4wdui - She's so festive aint' she hehe,http://twitpic.com/4wdui - She's so festive aint' she hehe,بەختەوەر
1752053933,500! نوێکارییەکان! واووو!! هاها!!,fun,gabriella_93,500! updates! wooow!! haha!!,500! updates! wooow!! haha!!,خۆشی
1752053971,هەبوونی مارگاریتا لەگەڵ دایکم...چ کۆمبۆیەکی نایاب!,fun,j_cheri,Having Margaritas w/ mommie...what a great combo!,Having Margaritas w/ mommie...what a great combo!,خۆشی
1752054005,من دەچم سەیری دیجیی ڤۆڵت دەکەم.,enthusiasm,Obie115,I'm going to go check out DJ Volt.,I'm going to go check out DJ Volt.,پەرۆش
1752054058,بۆ یەکەمجار بچۆ بۆ فیلمی درایف-ئین,fun,RyanMaSSacRe,Goin to drive-in movie for the first time,Goin to drive-in movie for the first time,خۆشی
1752054061,من هێشتا luv HAWKS ەکانم! من هیچ هەوادارێکی کەشوهەوای دادپەروەر نیم! من سواری یان دەمرم 4 هی خۆم!!,love,TiaBILL,I still luv my HAWKS! I aint no fair weather fan! I'm ride or die 4 mine!!,I still luv my HAWKS! I aint no fair weather fan! I'm ride or die 4 mine!!,خۆشەویستی
1752054095,چوونە سەر جێگا، لەگەڵ پیتەر.,neutral,Joeytragedy,"Going to bed, with peter.","Going to bed, with peter.",ئاسایی
1752054112,واو... تۆ ئەمە هەمووی لە ڕێگەی دەقەوە دەکەیت؟ دوای ماوەیەک ماندوو دەبووم,surprise,derekcody,@stephanierhenee wow... you're doing this all through text?  I would get tired after a while,wow... you're doing this all through text? I would get tired after a while,سوپرایز
1752054114,#bouvierb-day لەسەر بابەتەکانی ترێندەکانە. ahh ڕۆژی لەدایک بوونت پیرۆز بێت پیێر بۆڤیر,neutral,gabhii,#bouvierb-day is on trending topics. ahh Happy Birthday Pierre Bouvier,#bouvierb-day is on trending topics. ahh Happy Birthday Pierre Bouvier,ئاسایی
1752054182,کە زۆر نایاب و سەرنجڕاکێشە! ڕۆژەکەی بەسەر برد studyin، chillin a lil b4 goin بۆ جێگا، هێواش هێواش gettin ساردتر لە پاراگوای، زستان دێت,worry,claudiacabrera,"@SuperwomanAK that is awesome!  spent the day studyin, chillin a lil b4 goin to bed, its slowly gettin colder in Paraguay, winter is comin","that is awesome! spent the day studyin, chillin a lil b4 goin to bed, its slowly gettin colder in Paraguay, winter is comin",نیگەران
1752054263,بۆیە چوارشەممە دایکم ئێوارەخوانێکی تایبەتی گەورە دروست دەکات &amp; whatnot بۆ ئاهەنگ گێڕان بە تاکە گۆرانییە نوێیەکە، تەنها بۆ ئەوەی دەزانیت,surprise,cgreeeeeeen,"@TheRealJordin so wednesday my mom is making a huge special dinner &amp; whatnot to celebrate the new single, just so ya knoww","so wednesday my mom is making a huge special dinner &amp; whatnot to celebrate the new single, just so ya knoww",سوپرایز
1752054317,نیگەران مەبە ئاڤات دەبێت بۆ ئەوەی سەرقاڵت بکات لە گەشتەکەدا,happiness,JKlover,@JenAlaniz Don't worry you will have Ava to distract you on the flight,Don't worry you will have Ava to distract you on the flight,بەختەوەر
1752054505,چاکبوونەوە لە نەخۆشی ... کەس دەیەوێت شۆربام بۆ بهێنێت؟,fun,_rachelv,recovering from being sick ... anyone want to bring me soup?,recovering from being sick ... anyone want to bring me soup?,خۆشی
1752054535,ئەمڕۆ بۆ ماوەی ١٤ کاتژمێر یاری ئۆکامی کرد,happiness,Aerostella,played okami for 14 hours today,played okami for 14 hours today,بەختەوەر
1752054560,من لێرەم ئەگەر پێویستت بە هەواگۆڕکێیە!,worry,SMarsheck,@momtoboysx3 I'm here if u need to vent!,I'm here if u need to vent!,نیگەران
1752054668,تازە ئێوارەکەی لە ئاهەنگێکدا بەسەر بردووە بۆ یادی ٢٠ ساڵەی کۆمپانیای درامای ئامادەیی. یادگاری زۆر,happiness,katielynn783,Just spent the evening at a gala for her high school drama company's 20th anniversary. Lots of memories,Just spent the evening at a gala for her high school drama company's 20th anniversary. Lots of memories,بەختەوەر
1752054758,لە هەر کاتێکدا. ئامانجم دڵخۆشکردنە.,neutral,DerekMolata,@veschwab anytime. I aim to please.,anytime. I aim to please.,ئاسایی
1752054761,هێی بەیب فۆڵۆوم بکە،لۆڤ تۆ لە دا نمایش,love,CreshMulah,"@TerrenceJ106 Hey babe follow me,love u on da show","Hey babe follow me,love u on da show",خۆشەویستی
1752054803,کاتی ئەوە هاتووە کە کۆندیتۆنەکەم بشۆم,neutral,AtlantaJJ,Time to rinse out my conditoner,Time to rinse out my conditoner,ئاسایی
1752054810,دونیام دەهەژێنێت!!!! soooo کۆمیدییە!!!! &lt;3,love,zaigalib,@jtimberlake rocks my world!!!! soooo funny!!!!  &lt;3,rocks my world!!!! soooo funny!!!! &lt;3,خۆشەویستی
1752054829,شەوتان باش چاویلکە! گەورەترین خۆشەویستی کە هەتە بە دایکت بدە xxx,empty,Official_Roddy,Good night peeps! Give to your mom's the greatest love you have   xxx,Good night peeps! Give to your mom's the greatest love you have xxx,بەتاڵ
1752054888,باشترین هاوڕێی هەیە لە هەموو جیهان سوپاس بۆ ئەوەی ئاهەنگەکەت و ئەمڕۆش ئەوەندە تایبەت کرد!,love,cami_rib,has the best friends in the entire world  Thank you for making the banquet and today so special!,has the best friends in the entire world Thank you for making the banquet and today so special!,خۆشەویستی
1752054919,پۆپکردن بۆ بینینی سامسۆن و دێلیلا ئەم ئارڤۆیە، بیبیستن باشە,relief,dogacid,"Popping out to see SAMSON AND DELILAH this arvo, hear it is good","Popping out to see SAMSON AND DELILAH this arvo, hear it is good",ئارام
1752054962,خولگە-کێشکردن-مانگ-گەلانی بۆشایی ئاسمان-گالەکسی-هەسارە دەرەکییەکان-گەردوون-ژیان لە دەرەوەی زەوی-بیرۆکەی خوداوەندەکان-ئاینەکان-فەلسەفە-ئەخلاق,neutral,TaviGreiner,orbits-gravity-moon-space exploration-galaxy-exoplanets-universe-life beyond earth-idea of Gods-religions-philosophy-morality,orbits-gravity-moon-space exploration-galaxy-exoplanets-universe-life beyond earth-idea of Gods-religions-philosophy-morality,ئاسایی
1752055027,دەبینم سەرت نەتاشی. بەڵام من *خۆشمدەوێت* بڕینەکە. خۆشحاڵم کە ڕیشت نەتاشی. قژت زۆر جوانە!,love,millymarie,@thesedreams I see you didn't shave your head. But I *LOVE* the cut.  I'm glad you didn't shave it. Your hair's too pretty!,I see you didn't shave your head. But I *LOVE* the cut. I'm glad you didn't shave it. Your hair's too pretty!,خۆشەویستی
1752055031,خخخ...دەبێت دراوسێکانم بیر لەوە بکەنەوە im nuts...بۆ #canucks,happiness,accidentprone78,lol...my neighbors must think im nuts...for #canucks,lol...my neighbors must think im nuts...for #canucks,بەختەوەر
1752055032,لەجیاتی ئەوەی بە خودا بڵێم کێشەکانم چەند گەورەن، حەزم لێیە بە کێشەکانم بڵێم خودا چەند گەورەیە! http://bit.ly/5ofzj,relief,zuess369,"Instead of telling God how big my problems are, I like telling my problems how big God is!  http://bit.ly/5ofzj","Instead of telling God how big my problems are, I like telling my problems how big God is! http://bit.ly/5ofzj",ئارام
1752055050,تازە ئایپۆد تاچم دەستکەوتووە ئەپەکانی دابەزاندن بۆی ئێستا.,neutral,Bobby2525,Just got a Ipod touch  Downloading apps for it now.,Just got a Ipod touch Downloading apps for it now.,ئاسایی
1752055077,چۆنە ئوسترالی...im hopin بۆ ئەوەی لەوێ بم لە سیدنی لە کەمتر لە هەفتەیەک تەنها ڤیزاکەم وەرگرت لە پێنجشەممە whoot whoot,happiness,thewildjoker,@Custardcuppcake how is Aussie...im hopin to be there in Sydney in less than a week just got my VISA on thursday whoot whoot,how is Aussie...im hopin to be there in Sydney in less than a week just got my VISA on thursday whoot whoot,بەختەوەر
1752055101,هیچ نیگەرانییەک.. ئێستا دەچمە ABP. شتێکت دەوێت؟,neutral,khlpond,@cfree123 No worries..  Going to ABP right now. Want something?,No worries.. Going to ABP right now. Want something?,ئاسایی
1752086113,سێلین-ئەوە-بۆ-بەرزترین-پێداویستی-دابینکەر!! HEYYYYY مامە!,fun,SimplyMe28,@selin162 SELIN-It-To-the-Highest-Bidder!! HEYYYYY MAMA!,SELIN-It-To-the-Highest-Bidder!! HEYYYYY MAMA!,خۆشی
1752086144,نزیکە لە تەواوبوون فریشتە و جنۆکەکان، کتێبێکی سەرسوڕهێنەر، هەست بە زۆر چەقۆکێشی دەکەیت بۆ ئەوەی تەنها ئێستا خوێندوومەتەوە,relief,Patty_B,"Nearly finished Angels and Demons, awesome book, feel so lame for only reading it now","Nearly finished Angels and Demons, awesome book, feel so lame for only reading it now",ئارام
1752086156,بۆیە ئامادەن بۆ dc سبەی، وێنە trippin',fun,melissanosyke,"so ready for dc tomorrow, photo trippin'","so ready for dc tomorrow, photo trippin'",خۆشی
1752086172,http://twitpic.com/4we4j - وانەی خێرایی لەسەر شاشە سەرەکییەکان لە یاریگای ناوەند! ناچار بووم ئەم وێنەیە بگرم,neutral,I100,http://twitpic.com/4we4j - Speed lessons on the main screens on center court! I had to take this pic,http://twitpic.com/4we4j - Speed lessons on the main screens on center court! I had to take this pic,ئاسایی
1752086242,تازە تاتۆی سێیەمم وەرگرتووە owwwwwww خخخخ,worry,thepreppy2007,Just got my 3rd tattoo  owwwwwww lol,Just got my 3rd tattoo owwwwwww lol,نیگەران
1752086487,سوپاس بۆ فۆڵۆوفریدەی هون,surprise,bren3gold,@BlankMustDie thank you for the followfriday hun,thank you for the followfriday hun,سوپرایز
1752086497,http://twitpic.com/4wdnn - زۆر نایاب و سەرنجڕاکێشە.,neutral,Homesickblues,@therobertmorris http://twitpic.com/4wdnn - awesome.,http://twitpic.com/4wdnn - awesome.,ئاسایی
1752086500,تەنها قسەیەکی نایابم کرد لەگەڵ نیعمەت سەبارەت بەوەی کە خودا چەندە سەرسوڕهێنەرە و چۆن کاردەکات...کە بە جۆرێک لە جۆرەکان لە چۆنیەتی کارکردنی کۆنتڕۆڵی دوورەوە دەستی پێکرد,love,imageisfound,just had a great talk with grace about how awesome God is and how he works...that somehow started with how remote controls work,just had a great talk with grace about how awesome God is and how he works...that somehow started with how remote controls work,خۆشەویستی
1752086519,ئەو هاوڕەگەزباز نییە خخخخ. بە دڵنیاییەوە ئەو ئاژاوەگێڕییە، بەڵام لە کۆنسێرتەکەی nkotb نا. من دەمەوێت 2b کچێکی لێدراو کە هیچ سەرقاڵکردنێکی نەبێت ئەو شەو,neutral,LMRB,"@Cynthia2478 he's not gay Lol. He's a riot definitely, but not at nkotb concert. I want 2b a smitten girl with no distractions that night","he's not gay Lol. He's a riot definitely, but not at nkotb concert. I want 2b a smitten girl with no distractions that night",ئاسایی
1752086557,زۆر سوپاس بۆ تۆ Me neitherrrr!,happiness,g0shortiexx,@courrtneyyy Thank you so much  Me neitherrrr!,Thank you so much Me neitherrrr!,بەختەوەر
1752086612,ئای بە ڕەهایی! من ناتوانم چاوەڕێ بکەم تا کاهووەکان بێنە سەرەوە.,happiness,mightysmith,@DonyaMaries oh absolutely!  I cant wait for the lettuces to come up.,oh absolutely! I cant wait for the lettuces to come up.,بەختەوەر
1752086618,- yay بۆ ئەنجامدانی ئەرکەکان! ئای، کۆمەڵێک شت کە لە ژێر کۆنترۆڵی من دەرچوون. سەرەوەی w / پێشبڕکێیەکی چەوت، هاها,worry,aliciasparks,"@tncc24 - yay for getting errands done! oh, an assortment of out-of-my-control things. topped off w/ a crap race, haha","- yay for getting errands done! oh, an assortment of out-of-my-control things. topped off w/ a crap race, haha",نیگەران
1752086662,بێگومان! چاوەڕوانی ئەوەم,love,ambersmart,@theresa162 Absolutely! Lookin' forward to it,Absolutely! Lookin' forward to it,خۆشەویستی
1752086685,زۆرم خوارد,surprise,Maaayy,i ate so much,i ate so much,سوپرایز
1752086741,ڕۆژی دایکان پیرۆز بێت بۆ ئێوەش!,love,yadikeith,@iveeanne happy mothers day to you as well!,happy mothers day to you as well!,خۆشەویستی
1752086793,من لە تویتەر بەدوای کەسانی سەرنجڕاکێشدا دەگەڕام پاشان هی تۆم دۆزیەوە و لینکی بلۆگەکەت لە پڕۆفایلی خۆتدا بڵاوکرایەوە.,happiness,nelmski,@dzaniff I was searching for interesting people on twitter then i found yours and the link of your blog was posted on your profile.,I was searching for interesting people on twitter then i found yours and the link of your blog was posted on your profile.,بەختەوەر
1752086903,ئاه بەڵێ دەزانم کاتێک یەکترمان ناسی کە زبڵەکانم دەهێنایە دەرەوە، هاها,happiness,glitteryglossy,"@Ms_Nigeria oh yeah I know  We met when I was taking out the trash, hhaha","oh yeah I know We met when I was taking out the trash, hhaha",بەختەوەر
1752086929,ببورە ئازیزم... ئەمشەو لە هەموو شوێنێکم.. مەبەستم ئەوە نەبوو کە پشتگوێت بخەم..,worry,BengeeB,@atexasattitude I'm sorry darling... I'm all over the place tonight.. I didn't mean to neglect you..,I'm sorry darling... I'm all over the place tonight.. I didn't mean to neglect you..,نیگەران
1752087043,لە چەند کەسێکدا دەگەڕێمەوە .. من تۆ دەکەم بە شتێکی بچووک,enthusiasm,tracyewilli,@JohnnyDeppNews  back in a few .. i will make u a lil something,back in a few .. i will make u a lil something,پەرۆش
1752087098,ئەگەر تۆ لە ڕێگاکەدا بوویت لە منەوە دەتوانیت گرەو لەسەر ئەوە بکەیت کە من ڕاست لەوێ دەبووم #MMOT,neutral,ImTribute,@SticknYOU if you were down the road from me you can bet i would be right there  #MMOT,if you were down the road from me you can bet i would be right there #MMOT,ئاسایی
1752087119,دێنی لەگەڵ مایک و پات و جێسی.,neutral,jessepotter,"Denny's with Mike, Pat, and Jessie.","Denny's with Mike, Pat, and Jessie.",ئاسایی
1752087149,نوێترین پۆستی FB ببینە. (ئەو شتانەی کە دەمەوێت ڕوو بدەن). پێموانییە بتوانی لەدەستی بدەیت.,fun,trishknight,@otoole4info Check out my latest FB post.  (Things I want to happen). I don't think you can miss it.,Check out my latest FB post. (Things I want to happen). I don't think you can miss it.,خۆشی
1752087191,ئەمە: http://www.sife.org/usaexpo/,neutral,amygmoore,@caitiehendry this: http://www.sife.org/usaexpo/,this: http://www.sife.org/usaexpo/,ئاسایی
1752087192,سەیری فیلم دەکات,neutral,kib0t,is watching movies,is watching movies,ئاسایی
1752087272,ئاه thanx، تەنها کاتێک بیرم لەوە دەکردەوە کە ilost ئەوە، iappreciate it,relief,Chantresewright,"@ms_hypnotic oh thanx, just when i thought ilost it, iappreciate it","oh thanx, just when i thought ilost it, iappreciate it",ئارام
1752087391,نازانم. چی پێویستە بۆ ئەوەی کەرە بکەیت؟ کەرەی ڕاستەقینە؟ xoxo,worry,patrickallmond,@kelleydmcguire I don't know. What does it take to butter you up? Actual butter?  xoxo,I don't know. What does it take to butter you up? Actual butter? xoxo,نیگەران
1752087420,تۆ خاوەنی دیدجیریدۆیت؟!؟!,surprise,iiloveeyouu23,@MattG124 you own a didgeridoo?!?!,you own a didgeridoo?!?!,سوپرایز
1752087488,دەبێت بێیتە شیلی... لەگەڵ AC/DC باش دەبێت,worry,kalutty,@positron76 You have to come to Chile... with AC/DC would be fine,You have to come to Chile... with AC/DC would be fine,نیگەران
1752087493,http://twitpic.com/4we51 - هاوین لێرەدایە.,happiness,shamiahatesyou,http://twitpic.com/4we51 - summer is here.,http://twitpic.com/4we51 - summer is here.,بەختەوەر
1752087542,لەبەر ئەوەیە کە تۆ جەماوەریت,happiness,shinjiblue,@karinphillips it's because you're popular,it's because you're popular,بەختەوەر
1752087568,دڵنیابە ئەو دایکانە بزانن کە پێت وایە چەندە ئەفسانەیین!! نزیکە لە ڕۆژی دایک.,happiness,Alexis_Watson,Be sure to let the moms you know how fabulous you think they are!!   Almost Mother's Day.,Be sure to let the moms you know how fabulous you think they are!! Almost Mother's Day.,بەختەوەر
1752087572,ئەویش تێکستی توپاکی دەزانێت!,happiness,SimplyMe28,@dimples_03 He'll know Tupac lyrics too!,He'll know Tupac lyrics too!,بەختەوەر
1752087608,GREEN DAY هەفتەی داهاتوو لە SNL نمایش دەکات! ببورە، ئەوە دڵخۆشی کردم و هێشتا هەمووم دیتزیم لە سکیتەکانی جەستن تیمبەرلێک,sadness,kaitlintaylor,"GREEN DAY IS PERFORMING ON SNL NEXT WEEK!  sorry, that made me happy and i'm still all ditzy from the Justin Timberlake skits","GREEN DAY IS PERFORMING ON SNL NEXT WEEK! sorry, that made me happy and i'm still all ditzy from the Justin Timberlake skits",دڵتەنگ
1752087637,هیوای ڕۆژی دایک بۆ لیی پیرۆز بێت بۆ من! نیوەی شەوە لە نیویۆرک,happiness,AJsCuTiePiE93,@howie_d Wish Leigh a Happy Mother's Day for me! It's midnight in NY,Wish Leigh a Happy Mother's Day for me! It's midnight in NY,بەختەوەر
1752087676,بوتڵی ڕیئیسلینگ ئەمجارە... خۆشەویستترینی من!,love,sarasmatic,Bottle of reisling this time... My favorite!,Bottle of reisling this time... My favorite!,خۆشەویستی
1752087707,Multiply's بێزارکەر دەبێت :| خۆزگە ڕیشێل تویتەری هەبوایە. قەناعەت پێکردن وەرگیران هێر، ئایا یا؟,fun,thatissodope,"Multiply's getting boring :| I wish Reichelle has twitter. @isaofoz, convince recruit herr, will ya?","Multiply's getting boring :| I wish Reichelle has twitter. convince recruit herr, will ya?",خۆشی
1752087762,ئای پیاو، کە سوکس... نرخێک کە تۆ دەیدەیت بۆ ئەوەی لە چارتی ئۆرگدایت (و بەرپرسیار، و شتی وا...),worry,joekinkopf,"@acinerba Oh man, that sux... price u pay for being on the org chart (and responsible, and stuff...)","Oh man, that sux... price u pay for being on the org chart (and responsible, and stuff...)",نیگەران
1752087824,جیا تۆ!,enthusiasm,sunnyosl,@JoannePeh jia you !,jia you !,پەرۆش
1752087839,سوپاس کۆتایی هەفتەیەکی نایابتان بەسەر برد,happiness,alekandsteph,@mkeguy69 thank you  have a great weekend,thank you have a great weekend,بەختەوەر
1752087913,شەو شاد,neutral,heyheyrenae,"@Livefromthe225, goodnight",goodnight,ئاسایی
1752087914,زۆر سوپاس,relief,g0shortiexx,@nmogha9 Thank you so much,Thank you so much,ئارام
1752087963,*پێدەکەنێت* لە خوێندنەوە؟! ڕوو نادات! خۆشحاڵم کە ئەلیس لە دوشدا بوو، دەبوو بزانێت کە ئێمە نیگەران بین,worry,ucf0503,"@moviegirl09 *laughs* reading?!  not happening!  i'm glad alice was in the shower, she should've seen that we were going to be worried","*laughs* reading?! not happening! i'm glad alice was in the shower, she should've seen that we were going to be worried",نیگەران
1752088034,دوو وشە: گیرفانی گەرم. بە تامترین خواردن کە تا ئێستا دروست کراوە,love,MaricruzRamirez,Two words: hot pockets. Most delcious food ever created,Two words: hot pockets. Most delcious food ever created,خۆشەویستی
1752088048,ڕۆژی لەدایک بوونت پیرۆز بێت هیچم دەست نەکەوت بەڵام هیوای منت هەیە.,worry,alpalmer,"@scalzi Happy Birthday  I didn't get you anything, but you have my best wishes.","Happy Birthday I didn't get you anything, but you have my best wishes.",نیگەران
1752088056,هێشتا سەیری نەکردووە... بەڵام پێدەچێت فیلمێکی فێنک بێت.. بەهەر حاڵ دڵخۆشم بە سەیرکردن...ڕێزبەندی بکە دوای ئەوەی چووی سەیریم کرد بەڵێ..,fun,csupo,@AnoopDoggDesai i haven't watch it yet... but it seems like a cool movie.. anyway happy watching...rate it after u go watched it yea..,i haven't watch it yet... but it seems like a cool movie.. anyway happy watching...rate it after u go watched it yea..,خۆشی
1752088064,کۆتایی هەفتەی درێژ. سوپاس بۆ خوا دەتوانم ڕۆژی دووشەممە تێیدا بخەوم,relief,Relene,long weekend. thank god i can sleep in on monday,long weekend. thank god i can sleep in on monday,ئارام
1752088119,جەستن تیمبەرلێک و ئەندی سامبێرگ جارێکی تر دەیکەنەوە.. سکیتەکەی دایکی خۆشەویست لە SNL زۆر نایاب بوو,neutral,tonimr,Justin Timberlake and Andy Samberg do it again.. Mother Lover skit on SNL was great,Justin Timberlake and Andy Samberg do it again.. Mother Lover skit on SNL was great,ئاسایی
1752088121,سوپەر پەرۆش بووم,happiness,golferrrr,super excited,super excited,بەختەوەر
1752088160,کێ پێی وایە دەست بکەم بە بازرگانی ئایفۆن ئەپ دیڤلۆپمەنت؟ وەڵام بدەرەوە بۆ بردنەوەی کۆدێکی EasyWriter Pro!,enthusiasm,Appilicious,Who thinks I should start doing iPhone App Development business? @ reply to win an EasyWriter Pro code!,Who thinks I should start doing iPhone App Development business? reply to win an EasyWriter Pro code!,پەرۆش
1752088198,باشە ئەو دووانە گێلانەی دایک هیستری بوو خخخخ,happiness,caribb,Ok that mother fucking duet was hysterical LOL,Ok that mother fucking duet was hysterical LOL,بەختەوەر
1752088238,"Aight, pau au'au... بەرەو گۆڕەپانی بلایسدێل بۆ کۆنسێرتەکەی خانمانی ساڵانی هەشتاکان!!! چیهی... Awwritte!!!",happiness,Erock808,"Aight, pau au'au... Heading to the Blaisdell Arena for the Ladies of the 80's concert!!! CheeHee... Awwrrite!!!","Aight, pau au'au... Heading to the Blaisdell Arena for the Ladies of the 80's concert!!! CheeHee... Awwrrite!!!",بەختەوەر
1752088255,وای. THX WHIT!!!,happiness,JLovFab,LOL. THX WHIT!!!,LOL. THX WHIT!!!,بەختەوەر
1752088271,ڕۆشتن بۆ شوێنێک کە خەونی تێدا دەبینم...ڕەنگە لەوێ بتبینم!؟! خەونی شیرین، هەموو!,relief,krissyraudys,"off to a place where i dream...maybe i ll see you there!?!   sweet dreams, all!","off to a place where i dream...maybe i ll see you there!?! sweet dreams, all!",ئارام
1752088375,بەختەوەر ئی ڕۆیشت! حەسوود!,worry,tshumbie,@blathering lucky e went!  jealous!,lucky e went! jealous!,نیگەران
1752088394,,empty,phaoloo,@makinitrite,,بەتاڵ
