tweet_id,kurdish_tweets,sentiment,author,content,tweets,kurdish_sentiments
1752535839,http://twitpic.com/4wh4d - لۆرن سەرسوڕهێنەرە....باشە لەوەی کە لەسەر گردەکان دەیبینم خخخخخخخخخخخخخخخخخخخخخخخخخخخخخخخخخخخخخخخخخخخخخخخخخخخخخخخخخخخخخخخخخخخخخخخخخخخخخخخخخخخخخخخخخخخخخخخخخخخخخخخخخخخخخخخخخخخخخخخخخخخخخخخخخخخخخخخخخخخخخخخخخخخخخخخخخخخخخخخخخخخخخخخخخخخخخخخخخخخخخخخخخخخخخخخخخخخخخخخخخخخخخخخخخخخخخخخخخخخخخخخخخخخخخخخخخخخخخخخخخخخخخخخخخخخخخخخخخخخخخ.,happiness,MaxnOut,@laurenconrad http://twitpic.com/4wh4d - LAUREN is AMAZING....well from what I see on the hills lol  Seem like a great friend to have!!,http://twitpic.com/4wh4d - LAUREN is AMAZING....well from what I see on the hills lol Seem like a great friend to have!!,بەختەوەر
1752535935,شەممەیەکی بچووکی وەها باش. فیلمی Bed Bath و Beyond ی تێدا نەبوو، بەڵام Borders لە لیستەکەدا بوو. ناتوانم چاوەڕێی سبەینێ بکەم. ڕۆژێکی باش پلانی بۆ دانراوە,relief,reneehlock,"Such a good little Saturday. Didn't include Bed Bath and Beyond, but Borders was on the list. Can't wait for tomorrow. Good day planned","Such a good little Saturday. Didn't include Bed Bath and Beyond, but Borders was on the list. Can't wait for tomorrow. Good day planned",ئارام
1752535973,لێێێێێدا!,love,jensinspired,@tabbycat224 yay!,yay!,خۆشەویستی
1752535979,شەوێکی سەرسوڕهێنەر لە شارەکەدا,surprise,Music_Al,awesome night in the city,awesome night in the city,سوپرایز
1752535987,یاریکردن بە کارت لەگەڵ خوشکەزاکەم.,fun,hannah_duh,Playing cards with my niece.,Playing cards with my niece.,خۆشی
1752536014,شوێنم بکەوە هەنگوین,neutral,PROMISEMUSIC,@aljajackson Follow me honey,Follow me honey,ئاسایی
1752536015,خخخ تۆ زۆر شێت ... پێم وایە کە ئەو گۆرانیەم بیستووە b4,neutral,yosoyian,@markman641 LOL you so insane ... I think that I heard that song b4,LOL you so insane ... I think that I heard that song b4,ئاسایی
1752536095,ئای، ئەوە یادەوەرییە خۆشەکان دەهێنێتەوە... دەمەوێت، بەڵام ناتوانم پشیلە بچووکەکان بەجێبهێڵم! (وێنەیەکی تری باڵۆنم بۆ ناردووە),neutral,NicaNoelle,"@kylieireland Oh, that's bringing back fond memories... I WANT to, but I can't leave the kittens! (I sent you another pic of Balloon)","Oh, that's bringing back fond memories... I WANT to, but I can't leave the kittens! (I sent you another pic of Balloon)",ئاسایی
1752536132,لە کۆتاییدا هەزار هاوڕێمان لێدا! سوپاس!,happiness,TJMembers,"we finally hit 1,000 friends! thanks!","we finally hit 1,000 friends! thanks!",بەختەوەر
1752536181,Thx بۆ FF #followfriday,neutral,jeanneendo,@neestaples Thx for FF  #followfriday,Thx for FF #followfriday,ئاسایی
1752536207,هێی چێڵسی ئەمیراکەی! &lt;ufc&gt;,happiness,eekanem,hey chelsee its amiera!   &lt;ufc&gt;,hey chelsee its amiera! &lt;ufc&gt;,بەختەوەر
1752562320,ڕۆژی دایکان پیرۆز بێت دایکە!!! تۆم خۆش دەوێت.,love,Mmunoz2,Happy mothers day mom!!!  i love you.,Happy mothers day mom!!! i love you.,خۆشەویستی
1752562323,نوێژی تەسبیح لەگەڵ خێزانەکەم!,love,kahhhhla,praying the rosary with my family!,praying the rosary with my family!,خۆشەویستی
1752562354,omg patron is 1ofmy FAVS im so jealous icant do 10 بەڵام من دەتوانم 5 بکەم بۆیە بیکەم بە 15 ئەوەندە جدی im لە ئەلاباما visitin fam,surprise,A1ix,omg patron is 1ofmy FAVS  @NOEL4PRESIDENT im so jealous icant do 10 but i can do 5 so make it 15  so serious im in alabama visitin fam,omg patron is 1ofmy FAVS im so jealous icant do 10 but i can do 5 so make it 15 so serious im in alabama visitin fam,سوپرایز
1752562364,سەیرکردنی &quot;بەدوای ئەستێرەیەکدا بگەڕێ&quot; لەگەڵ دایکم دووبارە lub ah C hehe,happiness,musicjelly,watching &quot;Look for a Star&quot; with mom again  lub ah C hehe,watching &quot;Look for a Star&quot; with mom again lub ah C hehe,بەختەوەر
1752562397,خخخخ پیاو من 2 1 /2 کاتژمێر یەک iont چۆن من woulda کردم لەگەڵ دەرەوە نۆدل ڕامێن و t.v. کات,neutral,TrinityRayne,@iampritty lol man i got 2 1 /2 hrs an iont how i woulda made it wit out my ramen noodles and t.v. Time,lol man i got 2 1 /2 hrs an iont how i woulda made it wit out my ramen noodles and t.v. Time,ئاسایی
1752562405,کاتی ئەوە هاتووە هەموو ئەلبوومەکان لەسەر ڤینێل دەربکەینەوە! بەڵێس! کە فاب دەبێت! فاب! فاب!,surprise,birdiebreeze,@TheBeatles Time to reissue all @TheBeatles albums on vinyl!  yesss! that would be fab! fab! fab!,Time to reissue all albums on vinyl! yesss! that would be fab! fab! fab!,سوپرایز
1752562430,ئەوان سەردەکەون,happiness,k_pamplemousse,@VancityAllie they shall win,they shall win,بەختەوەر
1752562460,سڵاو لیندۆن - ئەگەر ئەمەت دەستکەوت پێش کاتژمێر ٤ی ئێوارە دووشەممە ١١ی ئایار - من پۆستم هەیە بۆ تۆ لە ڕێگەی تاسمانیا. دی ئێم من,neutral,diannagraf,@LyndonChester hi Lyndon - if you get this before 4pm Monday 11 May - i have mail for you from @amandapalmer via Tasmania. DM me,hi Lyndon - if you get this before 4pm Monday 11 May - i have mail for you from via Tasmania. DM me,ئاسایی
1752562626,چۆن هەست دەکەیت؟ و کاتێک r u guys دەگەڕێنەوە بۆ کەنەدا؟... وەرە بۆ ڤانکۆڤەر!,love,Shannoxo,how r u feeling? and when r u guys coming back to canad?... come to vancouver!,how r u feeling? and when r u guys coming back to canad?... come to vancouver!,خۆشەویستی
1752562628,ئوپ. من سەیری دایکم دەکەم&amp; کوڕەکەی خەوتووە و ing,neutral,reneelockey,Oops. I'm watching my mom&amp; son sleeping and  ing,Oops. I'm watching my mom&amp; son sleeping and ing,ئاسایی
1752562662,مام من و ئێریکەکە دەباتە دەرەوە بۆ jt بۆ شەوەکە.,neutral,cherryfizzyface,mum is driving me and the Eric out to jt for the night.,mum is driving me and the Eric out to jt for the night.,ئاسایی
1752562730,سبەی هەڵواسینی لەگەڵ کەڤین! دەرەوە دەچێتە دەرەوە بەرهەمدار بوون.,happiness,cannus,Hanging with kevin tomorrow!  out goes being productive.,Hanging with kevin tomorrow! out goes being productive.,بەختەوەر
1752562745,لە وهۆ! ئەوان زۆر یاری بریت دەکەن,fun,Saruhx,In weho! They're are playing a lot of brit,In weho! They're are playing a lot of brit,خۆشی
1752562793,چێژ وەرگرتن لە هەوای فێنک لە کەنار دەریا. یارمەتیم دەدات ئارام بم و ئارام بم.,neutral,Zaren89,Enjoying the cool breeze at the beach. It helps me relax and unwind.,Enjoying the cool breeze at the beach. It helps me relax and unwind.,ئاسایی
1752562804,wooohooo! من ڕیزی چوارەمم لە دواوە,happiness,nicolepenney,@artistiquemeg wooohooo! I'm fourth row back,wooohooo! I'm fourth row back,بەختەوەر
1752562815,من کچێکی ساوام دەبێت! (لە ١٧ ڕۆژی داهاتوودا!) پێموایە ئەمە لەبەردەستدا دەهێڵمەوە http://budurl.com/f9p5 شتە کۆمیدییەکان!,love,kimballroundy,I'm Having a Baby Girl! (In the next 17 Days!) I think I'm gonna keep this handy  http://budurl.com/f9p5 Funny Stuff!,I'm Having a Baby Girl! (In the next 17 Days!) I think I'm gonna keep this handy http://budurl.com/f9p5 Funny Stuff!,خۆشەویستی
1752562863,واو بەراست?!? ئایا ئەمە پێویستە؟؟,worry,MissReichow,@andycane wow.... really?!? is this necessary??,wow.... really?!? is this necessary??,نیگەران
1752562877,سەرسوڕهێنەرە شەوی پێنجشەممە بینیم. ئەوەندە گەورەیە. 100% کاستینگێکی تەواو.,happiness,onewayhisway7,Awesome  I saw it thursday night. It is so great. 100% perfect casting.,Awesome I saw it thursday night. It is so great. 100% perfect casting.,بەختەوەر
1752562909,دووبارە سەیرکردنی توایلایت !!! &lt;3 من سەیری شرۆڤەی دەنگی دەکەم، زۆر پێکەنیناوییە ;),happiness,twi_obsessed_xo,"Watching Twilight again  !!! &lt;3 I'm watching the Audio Commentary, it's sooo funny ;)","Watching Twilight again !!! &lt;3 I'm watching the Audio Commentary, it's sooo funny ;)",بەختەوەر
1752562939,تۆ هەرگیز تەنیا نیت تەنها کاتێک کە پێت وایە کەس گرنگی پێنادات، تێدەگەیت کە هەمیشە یەک کەس هەیە کە گرنگیت پێدەدات,neutral,lovenroo,"You're never alone Just when you think no one cares, you realize that there' always one person you cares for you","You're never alone Just when you think no one cares, you realize that there' always one person you cares for you",ئاسایی
1752562979,نووسینی کارتی ڕۆژی دایک بۆ دایکم و خاڵۆزاکان و AMYYYY ناتوانێت چاوەڕێی ئەوە بکات کە ببێتە دایکی,happiness,mcarta7,"writing out mother's day cards to mom, aunts, and AMYYYY can't wait for her to be a mommy","writing out mother's day cards to mom, aunts, and AMYYYY can't wait for her to be a mommy",بەختەوەر
1752563007,من دەمەوێت بخەوم XD !!!! بەڵام گۆرانییەکم لە سەرمدایە کە شێتم دەکات و نازانم گۆرانییەکە دەنووسم یان نا هاهاها,fun,true_rockstar,i want to sleep XD !!!! but i have a song in my head that make me crazy and dont know if i write the song or not hahhaha,i want to sleep XD !!!! but i have a song in my head that make me crazy and dont know if i write the song or not hahhaha,خۆشی
1752563078,سوپاس!! من و هاوڕێکانم چووین سەیری فیلممان کرد و لە ماڵی یەکێک لە هاوڕێکانم پانکەیکی چپس شوکولاتەمان خوارد. ئەفسانەیی بوو!,fun,lovebec,@Jasonniu thanks!!  my friends and I went and watched movies and ate chocolate chip pancakes at one of my friends' house. it was fabulous!,thanks!! my friends and I went and watched movies and ate chocolate chip pancakes at one of my friends' house. it was fabulous!,خۆشی
1752563127,شەربەتی سەوزە و میوەی نایابی هەیە لە کردنەوەی نۆدلەکانی لام لە 8@tradehub21 http://tinyurl.com/r65c68,happiness,claralim,Is having awesome fruits and vegetable juice at the opening of Lam's noodles at 8@tradehub21  http://tinyurl.com/r65c68,Is having awesome fruits and vegetable juice at the opening of Lam's noodles at 8@tradehub21 http://tinyurl.com/r65c68,بەختەوەر
1752563279,OMG، کاتی خەوتن، ئەمڕۆ ترسناک بوو، بەڕاستی هیوادارم باشترین کۆتایی هەفتە *---*..شەو باش هاوڕێیان,sadness,jooooee,"OMG, time to sleep, today was an horror, i really hope best weekends *---*..Goodnight buddies","OMG, time to sleep, today was an horror, i really hope best weekends *---*..Goodnight buddies",دڵتەنگ
1752563324,سەیرکردنی &quot;سپرای قژ&quot;,neutral,Gotmegoingcrzy,Watching &quot;Hairspray&quot;,Watching &quot;Hairspray&quot;,ئاسایی
1752563328,بەڵێنم دا جارجارە تویتەرەکەم نوێ بکەمەوە. خخخ سڵاو لە دایکت بکە بە سادەیی بڵێیت YOUR HOT,fun,anikarawr,I promised to update my twitter every now and then. LOL Greet your mom by simply saying YOUR HOT,I promised to update my twitter every now and then. LOL Greet your mom by simply saying YOUR HOT,خۆشی
1752563400,thats coz ئێمە خۆشمان دەوێیت,worry,DamienCripps,@kimberley_ thats coz we love you,thats coz we love you,نیگەران
1752563418,aww! ڕۆژی دایکتان پیرۆز بێت کچە! kingston بەختی وایە کە دایکی وەها گەورەی هەیە!,happiness,suprlatina,@MollyMazy aww!  happy mother's day to you too girlie! kingston is lucky to have such a great mommy!,aww! happy mother's day to you too girlie! kingston is lucky to have such a great mommy!,بەختەوەر
1752563487,من هەموو هاوڕێکانمم خۆشدەوێت و وێنەکێشان ئەمشەو خۆش بوو,love,Beffawup,I love all my friends  @christickell @micahdwhitehead @johndavidwright @vivianleighturn and drew were fun tonight,I love all my friends and drew were fun tonight,خۆشەویستی
1752563533,تەنها تەواوکردنی خوێندن بۆ LSAT و سەیرکردنی VH1 Soul,relief,GhanaSweetheart,just finishing studying for LSATs and watching VH1 Soul,just finishing studying for LSATs and watching VH1 Soul,ئارام
1752563563,ئاهەنگی ١٨ هەزار شانۆگەری لە Last.fm لەگەڵ Dez Moines لەلایەن #tdwp http://bit.ly/GWUHX,happiness,xt0rrent,"Celebrated 18,000 plays on Last.fm with Dez Moines by #tdwp http://bit.ly/GWUHX","Celebrated 18,000 plays on Last.fm with Dez Moines by #tdwp http://bit.ly/GWUHX",بەختەوەر
1752563769,ئەمە زۆر نایاب و سەرنجڕاکێشە!,relief,lissytran,This is cool!,This is cool!,ئارام
1752563778,بە فەرمی حجز کراوە بۆ seattle لەگەڵ و دەبێتە باشترین کۆتایی هەفتەی لەدایکبوون تا ئێستا! :تۆ دڵتەنگت کردم,sadness,Carrie_Lane,OFFICIALLY booked for seattle with @cfine1 and @ebotkin12 it's going to be THE best birthday weekend EVER!  @bradlawrence :you made me sad,OFFICIALLY booked for seattle with and it's going to be THE best birthday weekend EVER! :you made me sad,دڵتەنگ
1752563793,هاوڕێیان نەماون. سوشی، فیلم، پێکەنین. تەنها ئەوەی کە پێویستم بوو. خۆش!,fun,lionl,"Friends are gone. Sushi, movies, laughter. Just what I needed. FUN!","Friends are gone. Sushi, movies, laughter. Just what I needed. FUN!",خۆشی
1752563803,سوپاس! دەبێت ئێوەشم هەبێت کاتێک مۆبیلیاتمان هەبوو.,neutral,d4rkspike,@jimmydouglas Thanks! I'll have to have you guys over once we have furniture.,Thanks! I'll have to have you guys over once we have furniture.,ئاسایی
1752563858,هێشتا خۆشم دەوێت &quot;سیزلەر&quot; هەرچەندە...و چاک NIce. وە دۆگ بێنسۆن. وە پاوڵ شیر. وە نیک کرۆڵ. هەندێک گێیکم خۆش بوێت,love,KaraMAdams,Still love &quot;The Sizzler&quot; though...and Chuck NIce. And Doug Benson. And Paul Scheer. And Nick Kroll.  Love me some geeks,Still love &quot;The Sizzler&quot; though...and Chuck NIce. And Doug Benson. And Paul Scheer. And Nick Kroll. Love me some geeks,خۆشەویستی
1752563892,ئەگەر من لەگەڵ بروکلین لە خەو هەڵسام کاتێک بڕیارە لەناودا بخەوم...پێت دەڵێم LadyBug602,happiness,LynnAdams1179,If I'm up with Brooklyn when I'm suppose to sleep in...I'll call you  @ LadyBug602,If I'm up with Brooklyn when I'm suppose to sleep in...I'll call you LadyBug602,بەختەوەر
1752563895,پێویستم بە 2 b 2 خەوتن 4 شەو. یەکشەممەتان باش,surprise,splitenz,@chiwhitesox i need 2 b getting 2 sleep 4 the night. Have a good sunday,i need 2 b getting 2 sleep 4 the night. Have a good sunday,سوپرایز
1752564030,من &lt;3 ڕوپەرت گرینت......&amp; لە کوڕەکە، Ive قبوڵ tht من فەنتازیا ئەو بەڵام im دڵنیا ئەو هەست بە هەمان شت ناکات بۆیە شایەنی ئەوە نییە پێی بڵێم,sadness,Tifferz1517,"I &lt;3 Rupert Grint......&amp; of the boy, Ive accepted tht I do fancy him  But im certain he doesnt feel the same so its not worth telling him","I &lt;3 Rupert Grint......&amp; of the boy, Ive accepted tht I do fancy him But im certain he doesnt feel the same so its not worth telling him",دڵتەنگ
1752564040,باوەش دەکات 4 kathy. هەرچەندە دایکم لە بەهەشتدایە، بەڵام دەزانم کە زەردەخەنە دەکات بۆ دەستکەوتەکانم &amp; هەموو ئەو کەسانەی کە من بە ئەرێنی دەهێڵنەوە.,love,eclecticeddie,"@kathyIreland Hugs 4 kathy. Though my mom's in heaven, I know she's smiling at my accomplishments &amp; all the people who keep me positive.","Hugs 4 kathy. Though my mom's in heaven, I know she's smiling at my accomplishments &amp; all the people who keep me positive.",خۆشەویستی
1752564078,نەخێر، سان لیاندرۆ مارینا. چۆنی? هیوادارم باشبیت!,worry,emmelinek,"nope, san leandro marina.    how are you?  hope you're well!","nope, san leandro marina. how are you? hope you're well!",نیگەران
1752564092,چەند دیارییەکی نایابی ڕۆژی لەدایکبوونم وەرگرت! پارتی سەرکەوتنی ئاسایی بوو.,happiness,j_sho,I received some excellent birthday presents!  Party was the usual success.,I received some excellent birthday presents! Party was the usual success.,بەختەوەر
1752564116,ڕۆژی دایکم پیرۆز بێت بۆ دایکت بڵێ تۆش خەڵکی فلیپینی؟,love,jeanninesioco,@glammyts happy mum's day to ur mom  say you're from the philippines too?,happy mum's day to ur mom say you're from the philippines too?,خۆشەویستی
1752564123,یەکەم ڕۆژی دایکان پیرۆز بێت دووەم چییە وامان لێدەکات بەو شێوەیە بیربکەینەوە؟ بۆچی هەست بەو جۆرە دەکەین کە هەست دەکەین؟ من نازانم بەڵام خۆزگە دەمکرد,love,lynnrose14,First Happy Mothers Day  Second what is it that makes us think the way we do? Why do we feel the way we feel? I dont know but i wish i did,First Happy Mothers Day Second what is it that makes us think the way we do? Why do we feel the way we feel? I dont know but i wish i did,خۆشەویستی
1752564153,نەخێر... بەڵام هاوڕێیەکی نوێی گرافیک دیزاینم ناسی، بۆیە ئەوە dooope بوو!!!,love,mynameiskaye,"@DeLaSelis no... But I met a new graphic design friend, so that was dooope!!!","no... But I met a new graphic design friend, so that was dooope!!!",خۆشەویستی
1752564214,بڕیارە مۆخیتۆیەک بخواتەوە و لەگەڵ هاوسەرەکەم پاڵ دەکەوێت بۆ سەیرکردنی فیلم. شەوتان باش هاوڕێ تویتەرەکان,neutral,Songbird1988,is going to drink a mojito and lay down to watch movies with my hubby. Goodnight fellow tweeters,is going to drink a mojito and lay down to watch movies with my hubby. Goodnight fellow tweeters,ئاسایی
1752564218,تەنها ویستم سڵاو بکەم,neutral,DefyGravity81,@simplyshannon just wanted to say hello,just wanted to say hello,ئاسایی
1752564229,لە پێداچوونەوەی FP'09 ی خۆی ڕازییە,neutral,superchauie,is satisfied with her FP'09 review,is satisfied with her FP'09 review,ئاسایی
1752564275,ڕۆژی لەدایکبوونی frickin' پیرۆز بێت! هەوڵبدە زۆر تاڵ نەبیت لە هاوبەشکردنی ڕۆژەکەت لەگەڵ هاوسەرە خۆشەویستەکەت و هەموو دایکانی تری دەرەوە.,happiness,chinkleDC,@scalzi Happy frickin' birthday!  Try not to be too bitter about sharing your day with your lovely wife and all other mothers out there.,Happy frickin' birthday! Try not to be too bitter about sharing your day with your lovely wife and all other mothers out there.,بەختەوەر
1752564401,ڕۆژی دایک لە هەموو دایکانی ئێرە پیرۆز بێت!,worry,MarieWillow,Happy mother's day to all mothers here!,Happy mother's day to all mothers here!,نیگەران
1752564419,سەیرکردنی مەل و بای سوور و خواردنی سۆسی سێو.,neutral,my_level,watching crimson tide and eating apple sauce.,watching crimson tide and eating apple sauce.,ئاسایی
1752564448,دیسانەوە، ڕازی بوو. بەڵام هەبوونی بەرنامەیەک کە نیشان بدات هاوڕێکانت لە فەیسبووکدان ئاسانتر دەبێت لە پێدانی every1 yer info,neutral,sweisbrot,"@monicaobrien again, agreed. but having a program showing your friends are on facebook would be easier than giving every1 yer info","again, agreed. but having a program showing your friends are on facebook would be easier than giving every1 yer info",ئاسایی
1752564450,گوێم لە وەڵامەکەت بوو! من زۆر ئیرەیی دەبەم! kevin خۆشەویستترینی منە! هاها,worry,brianaip,@lexjosephine I heard about your reply! im so jealous! kevin is my favorite! haha,I heard about your reply! im so jealous! kevin is my favorite! haha,نیگەران
1752564489,هاهاها ئەوە تەنها یەکەمجارە! من بە 40 خولەک لە 5k دەستم پێکرد. ئەوە ساڵێک لەمەوبەر بوو.,neutral,outednarnian,@jaybeecc hahaha sa una lang yan!  i started with 40 minutes ng 5k.  that was a year ago.,hahaha sa una lang yan! i started with 40 minutes ng 5k. that was a year ago.,ئاسایی
1752564543,چێژێکی بێئەندازەم هەیە کە لەلایەن پراید &amp; پێشوەختە بۆ جاری سێیەم و دەبێت بڵێم کە زۆر بە ڕەزامەندی دەزانم,love,pnay,I have the immense pleasure of being entertained by Pride &amp; Prejudice for the 3rd time and I must say that I find it very much agreeable,I have the immense pleasure of being entertained by Pride &amp; Prejudice for the 3rd time and I must say that I find it very much agreeable,خۆشەویستی
1752564545,ڕۆشتن بۆ هەندێک خەوتن، g'night هەمووان! بەهیوای ئەوەی ڕۆژێکی خۆشتان بەسەر بردبێت,neutral,VAEOU,"Off for some sleep, g'night everybody! Hope you had a good day","Off for some sleep, g'night everybody! Hope you had a good day",ئاسایی
1752564606,هیچ شتێک نییە بیکەم &gt;.&lt;..any1 wanna keep me company?,neutral,bitt3rswe3tlov3,nothing to do &gt;.&lt;..any1 wanna keep me company?,nothing to do &gt;.&lt;..any1 wanna keep me company?,ئاسایی
1752564622,{بەردەوام} کە ڕاست ئەوان بۆچی btches ساختە shouldnt تێکەڵاو لەگەڵ Real ones... ahhh من خۆشم دەوێت btches ڕاستەقینە وروژێنەرم,fun,JBeauty,{cont} that right their is why fake btches shouldnt mess with Real ones... ahhh I love it Real btches excite me,{cont} that right their is why fake btches shouldnt mess with Real ones... ahhh I love it Real btches excite me,خۆشی
1752564630,http://twitpic.com/4wh4d - ئەوەندە نازدارە ii ئەمەم خۆشدەوێت,love,xOxOjennatoOr,@laurenconrad http://twitpic.com/4wh4d - so cute ii love this,http://twitpic.com/4wh4d - so cute ii love this,خۆشەویستی
1752564685,من وەک ئەوە ڕەفتار دەکەم کە تەمەنم ٨ ساڵە، بۆیە من تەمەنم ٨ ساڵە.,neutral,chibirenachan,"I act like I'm 8. Therefore, I am 8.","I act like I'm 8. Therefore, I am 8.",ئاسایی
1752564774,ڕۆژی دایکان پیرۆز بێت هەمووان! باوەش و خۆشەویستی، زۆی,love,zoemoon,"Happy Mothers Day all!  Hugs and love, Zoe","Happy Mothers Day all! Hugs and love, Zoe",خۆشەویستی
1752564785,تا وەک مانگی داهاتوو لە ماڵەوە نابینەوە,surprise,chrisandcaleb,@DanielJeffreys we won't be home till like next month,we won't be home till like next month,سوپرایز
1752564801,سوپاس بۆ باشە ...هیوادارم بتوانین زیاتر تویت بکەین لە ڕێگاکەدا,worry,AshleygirlAz,@SusanRaymond thanks for the ok ...hope we can tweet more down the road,thanks for the ok ...hope we can tweet more down the road,نیگەران
1752564894,لێرەدا هاوکسەکان دێن، بلاکهۆکە بەهێزەکان!!,enthusiasm,bdevil4,"Here come the Hawks, the mighty Blackhawks!!","Here come the Hawks, the mighty Blackhawks!!",پەرۆش
1752564928,Omg وانگۆ تانگۆ گێل بوو AWSOME! من کۆرپەکەمم خۆشدەوێت کە منی بردووە,worry,GreenFreak5507,Omg Wango Tango was fucking AWSOME! I love my baby for taking me,Omg Wango Tango was fucking AWSOME! I love my baby for taking me,نیگەران
1752564972,is uuuu ڕۆژی دایکان پیرۆز بێت,worry,THe_RuGGeD_MaN,@BLaCkitaLiaNa7 ay uuuu  happy mothers day,ay uuuu happy mothers day,نیگەران
1752564981,کە تەنها دەنگێکی ئارەزووی خواردنی نییە.,hate,momsontheedge,@KelsyC That just doesn't sound appetizing.,That just doesn't sound appetizing.,ڕق
1752564999,بیرت دەکەم,sadness,nkole,@LaurenBakarian: i miss you,i miss you,دڵتەنگ
1752565041,خۆش بوو ئەمشەو چاوم پێت کەوت &amp; سوپاس!!,happiness,thatladyj,@bsaeed it was nice to meet you tonight &amp; thanks!!,it was nice to meet you tonight &amp; thanks!!,بەختەوەر
