tweet_id,kurdish_tweets,sentiment,author,content,tweets,kurdish_sentiments
1962695967,لە کۆبوونەوەیەکی سەرنجڕاکێشەوە بۆ داواکارییەکی پشتگیری بەپەلە کێشا,surprise,tjbladez,pulled from interesting meeting to an urgent support request,pulled from interesting meeting to an urgent support request,سوپرایز
1962696632,پێشنیاری مۆسیقام پێویست بوو بەڵام کەس نایاندات,sadness,mecharaider,i neeeeeeeed music suggestions but no one will give them,i neeeeeeeed music suggestions but no one will give them,دڵتەنگ
1962696685,نایت ئۆنلاین وەرەوە,fun,NeFReTBoYSs,Knight Online Come Back,Knight Online Come Back,خۆشی
1962697086,ermm، من من من!!,happiness,stu_boy,"@SallyTraffic ermm, me me me!!","ermm, me me me!!",بەختەوەر
1962697179,تەنها ڕێزی لە کەسێک لەدەستداوە.,sadness,Beejing,Just lost respect to someone.,Just lost respect to someone.,دڵتەنگ
1962697308,ئاه، ببورە کە بیستم گەشتەکەت هەڵوەشایەوە,worry,Silkytooth,"@autonomy14 Ah, sorry to hear your trip was canceled","Ah, sorry to hear your trip was canceled",نیگەران
1962697318,سیمس ٣ لەسەر ماکبووکی کۆنەکەم کار نەدەکرد هیوادارم تا سبەی سیمس ٢ بەدەست بهێنم.,sadness,_blackmamba_,Sims 3 wouldn't work on my old macbook  hope to get Sims 2 by tomorrow.,Sims 3 wouldn't work on my old macbook hope to get Sims 2 by tomorrow.,دڵتەنگ
1962697780,aw خۆزگە دەمتوانی. دەبێت خۆم بۆ ئەتڵەنتا ئامادە بکەم و دەبێت بێمە سەر کارەکەم لەبەر ئەوەی لە کارەکەمدا دواکەوتووم,sadness,gabboucla,@nikkilynnsd aw i wish i could.  i have to get ready for atlanta and i have to come into work since I am behind on work,aw i wish i could. i have to get ready for atlanta and i have to come into work since I am behind on work,دڵتەنگ
1962697969,کتێبفرۆشی MIT باشترین هەڵبژاردنی کتێبی هەیە، بەڵام ئەوە ئەو یەک کتێبفرۆشەیە کە هیچ کووپن و داشکاندنێکم بۆ نییە,sadness,whowantssoup,"MIT bookstore has best book selection, but it's the one bookstore I have no coupons or discounts for","MIT bookstore has best book selection, but it's the one bookstore I have no coupons or discounts for",دڵتەنگ
1962698312,من ناتوانم فۆڵۆوی any1 بکەم لە FollowFriday خخخ u guys follow,neutral,AmberTen,I cant follow any1  on FollowFriday LOL u guys follow @SteveRaze @djpooh @losdigital @djsmartiez @djeightmile @maestro @rollingout @djlgee,I cant follow any1 on FollowFriday LOL u guys follow,ئاسایی
1962698425,خەریکە دەست دەکات بە ئامادەکاری بۆ کار. پێشتر لێکسی بردە دەرەوە بۆ پارکەکە! خۆزگە دەمتوانی بە درێژایی ڕۆژ لە دەوروبەرمدا پاڵ بکەوێت.,sadness,RachaelSun,about to start getting ready for work.  took lexi out to the park earlier! wish i could lay around ALL day.,about to start getting ready for work. took lexi out to the park earlier! wish i could lay around ALL day.,دڵتەنگ
1962698738,ئیم دابەزاندنی دەستی فیلمی oooiifull.mp4 لەلایەن وەک پێدەچێت تاکە ڕێگە بۆ بینینی بە تەواوی,worry,savvasmalamas,Im downloading manually the oooiifull.mp4 movie by @leebrimelow as it seems the only way to see it fully,Im downloading manually the oooiifull.mp4 movie by as it seems the only way to see it fully,نیگەران
1962699796,بەڵێ!!,happiness,weiseldog,@WerewolfSeth YES!!,YES!!,بەختەوەر
1962699865,دوعا بۆ خێزانەکەم و سەگەکەم - ئەمڕۆ پاشنیوەڕۆ مۆزارت دادەنرێت. وێنەی ئەو لە http://tinyurl.com/mozartdog,neutral,mellanella,Prayers for my family and my dog - Mozart is being put down this afternoon.   Pics of him at http://tinyurl.com/mozartdog,Prayers for my family and my dog - Mozart is being put down this afternoon. Pics of him at http://tinyurl.com/mozartdog,ئاسایی
1962700122,بۆچی?,neutral,cliff10001,@EuanGriffin Why?,Why?,ئاسایی
1962700257,گرنگی بە خەباتەکانم مەدە..,sadness,kooltycoon,@lyricals don't care about my struggles..,don't care about my struggles..,دڵتەنگ
1962700469,هێشتا ناتوانم بخەوم..missin' my dobby...,worry,ranisherly,Still can't sleep..missin' my dobby...,Still can't sleep..missin' my dobby...,نیگەران
1962700720,دیسانەوە HD فول... http://plurk.com/p/x2eb3,surprise,articlescholar,HD full again...  http://plurk.com/p/x2eb3,HD full again... http://plurk.com/p/x2eb3,سوپرایز
1962701076,بە هۆکارێکی داماوەوە کۆشکەکەم لە سەرەوە چەسپاوە. وە بە هۆکارێکی ترەوە کتێبێکی مێژووی خێزانەکەی پێیەوە گرێدرا ئێستا پشتەکەی جاک کراوە,hate,lightmanx5,"For some dumb reason my dresser is sticky on top. And for another reason, a family history book got attached to it  Now the back is jacked","For some dumb reason my dresser is sticky on top. And for another reason, a family history book got attached to it Now the back is jacked",ڕق
1962701270,هێشتا بیردەکەمەوە ... Idk,neutral,krystynchong,I'm still thinking ... Idk,I'm still thinking ... Idk,ئاسایی
1962702233,من کێکم دەوێت ئایا شوکولاتەیە!؟؟,neutral,evegboop,@michy_mar_mey I want cake  is it chocolate!??,I want cake is it chocolate!??,ئاسایی
1962702673,کێ هەموو ئەمانە دەڵێت...ئایا تۆ پشتگوێم دەخەیت *ڕووخسار دەبڕێت*,neutral,MsMarcella,@proactiff WHO IS SAYING ALL THIS...are you ignoring me *frowns*,WHO IS SAYING ALL THIS...are you ignoring me *frowns*,ئاسایی
1962702878,منیش تۆ چی دەکەیت؟,neutral,suifeat,@cailingg me too  what are you doing?,me too what are you doing?,ئاسایی
1962703028,بیری بووەکەم دەکەم لەسەر تێبینییەکی تر من soready بۆ ئەم یارییە کە ئەمشەو بێتە سەر...فۆکس گریل هەرکەسێک؟؟؟!!,sadness,HIJayRenee,i miss my boo  on another note im soready for this game to come on tonight...fox grill anyone???!!,i miss my boo on another note im soready for this game to come on tonight...fox grill anyone???!!,دڵتەنگ
1962703323,iLook خەبات دەکات بۆ ئەوەی Outlook زیاتر کۆمەڵایەتی بکات http://bit.ly/JjUdF سەرنجڕاکێش دەردەکەوێت، هیچ پشتگیرییەکی تویتەر نییە؟,worry,vBSetup,"iLook struggles to make Outlook more social http://bit.ly/JjUdF looks interesting, no Twitter support?","iLook struggles to make Outlook more social http://bit.ly/JjUdF looks interesting, no Twitter support?",نیگەران
1962703698,هێشتا کاتێکی زۆرم ماوە لەسەر گرێبەستە گەمژەکەم... ١٨ مانگ پێش ئەوەی بتوانم دابینکەرەکان بگۆڕم,sadness,moonslark,@sunilsebastian I still have a lot of time on my stupid contract...  18 months before I can change providers,I still have a lot of time on my stupid contract... 18 months before I can change providers,دڵتەنگ
1962703850,ئازاری سک...lulz....ببورە هەرچەندە ....زەنجەفیل!,neutral,BryanKAdams,@kassielovee belly ache...lulz....I'm sorry though  ....ginger ale!,belly ache...lulz....I'm sorry though ....ginger ale!,ئاسایی
1962703920,بەڵێ,empty,underwater_love,@gcrecords yes,yes,بەتاڵ
1962703924,حەز دەکات بگەڕێتەوە سەر جێگاکەت. سەرئێشەی ترسناک کە لە پشت چاوەکانم و هەموو کەللەسەرمەوە دەلێسێت,worry,mujeragualuna,would like to go back to bed. horrible headache pounding behind my eyes and all over my skull,would like to go back to bed. horrible headache pounding behind my eyes and all over my skull,نیگەران
1962704109,سوپاس کلێر، تا ئێستا سەیریم نەکردووە.,happiness,loopylou15,"@heloloser thanks clair, I haven't watched it yet.","thanks clair, I haven't watched it yet.",بەختەوەر
1962704142,دەبوو ئۆتۆمبێل بەجێبهێڵێت و بە پێ بچایە ماڵەوە! لەوانەیە پێویستم بە کەسێک بێت بە بەنزین ڕزگارم بکات! چرپەی ڕووناکی,worry,Lopsi,Should have left car and walked home! I might need someone to rescue me with petrol! Light flashing,Should have left car and walked home! I might need someone to rescue me with petrol! Light flashing,نیگەران
1962704156,شەوتان باش هون. واتە کاتێک بە زیندووی دەڕۆیت,worry,rodentvs,@3CB goodnight hun. Yaani nakam wakati unaenda  @soleaddict1 hai,goodnight hun. Yaani nakam wakati unaenda hai,نیگەران
1962704366,- یا بەڵام دەبێت سەرەتا قسەت لەگەڵ بکەن بۆ ئەوەی وەڵامیان بدەنەوە..,neutral,Jokerscuckoo,@carbyville - Ya but they have to speak to you first to reply to them..,- Ya but they have to speak to you first to reply to them..,ئاسایی
1962705248,بەڵام دایکم تەنها هەندێک بیکۆنی سووتاندووە... زەنگی دوکەڵی کۆیلەیە,worry,heroofthehour,but mum just burned some bacon... smoke alarm's a bitch,but mum just burned some bacon... smoke alarm's a bitch,نیگەران
1962705332,دەزانم نابێت ئەمە بڵێم بەڵام گێل..من وەک جەهەنەم کۆڕم,happiness,MsMusiclover,I know I shouldn't be saying this but fuck it..I'm horny as hell,I know I shouldn't be saying this but fuck it..I'm horny as hell,بەختەوەر
1962705336,خخخخ کچ من ناتوانم بوەستم!!! من خوێندکارم، توانای کڕینی ١٤ دۆلارم نییە بۆ هەر سێبەری چاوی پۆپ. بەڵام من ئەوەندە گیرۆدە بووم,happiness,danni82,"@GirlUSoCrazy lol girl I cannot stop!!! I am a student, I can't afford $14 a pop eyeshadows. But I am so hooked","lol girl I cannot stop!!! I am a student, I can't afford $14 a pop eyeshadows. But I am so hooked",بەختەوەر
1962705507,بەلایەنی کەمەوە ٣ ڕۆژی تر,sadness,Brittany_M,at least 3 more days,at least 3 more days,دڵتەنگ
1962705611,من تەنها فۆڕمەکانم پڕکردەوە بۆ ئەوەی بەشداریکردنم لە ئەژمێری خانەنشینی ڕابگرم کە لەگەڵ خاوەنکارەکەم دامەزراندبووم دەبێت کارتی بانکییەکەم بدەمەوە,neutral,izin,I just filled out the forms to stop contributing to the retirement account i had set up with my employer  I have to pay off my credit card,I just filled out the forms to stop contributing to the retirement account i had set up with my employer I have to pay off my credit card,ئاسایی
1962706275,:: هەستەکە دەزانم کەمێک خەمۆکە :S,worry,1azylizzie,@SavageMike :: I know the feeling  Its a little depressing :S,:: I know the feeling Its a little depressing :S,نیگەران
1962707895,زۆر داوای لێبوردن دەکەم.,worry,happywhenwetalk,@berrylies I am so sorry.,I am so sorry.,نیگەران
1962708129,whatz کە بڕیار بوو مانای ئەوە بێت کە من سەگێکم هەیە ئێستا waaaaaaaaaah lol jk,fun,ReinaDeFab,@zinzR0ux whatz that supposed to mean  i have a dog now  waaaaaaaaaah lol jk,whatz that supposed to mean i have a dog now waaaaaaaaaah lol jk,خۆشی
1962708205,هەست دەکەم حەز دەکەم بگریم! یەکێک لە گوارە ئەڵماسییەکانم لە گوێمەوە کەوتە دەرەوە bc شل بوو و نایدۆزمەوە. من بۆ هەمیشە ئەوانم هەبووە,worry,PrettyLittlePet,I feel like crying! One of my diamond earrings fell out my ear bc it was loose and I can't find it. I've had them forever,I feel like crying! One of my diamond earrings fell out my ear bc it was loose and I can't find it. I've had them forever,نیگەران
1962708234,TGIF!!! بەڵام هەروەها بەداخەوە کە ئەمە دوا ڕۆژە کە دەگەم بە کار لەگەڵ پەیامنێری تەلەفزیۆنی دڵخوازم,sadness,richardjluna,TGIF!!! But also sad that this is last day I get to work with my favorite TV reporter,TGIF!!! But also sad that this is last day I get to work with my favorite TV reporter,دڵتەنگ
1962708320,ئەوە هاو دا زا جی پایە؟؟ زۆر بیری خواردنی ئەوێ دەکەم؟؟,neutral,MyMandyy,@sgBEAT:kwanghock @Valkyrieslife @kahhongtay @jeremy89632 it is the Hao Da Za Ji Pa?? I miss the food there so much??,it is the Hao Da Za Ji Pa?? I miss the food there so much??,ئاسایی
1962708361,خەمۆک کە هەردووکیان پێشتر لە دەرەوەن بەڵام هی تۆ isnt. کتێبەکەتم دەوێت!!,sadness,MDobson84,@YasmineGalenorn depressed that both of those are already out but yours isnt. I want your book!!,depressed that both of those are already out but yours isnt. I want your book!!,دڵتەنگ
1962708562,هەست. نەخۆش. هەروەها. زیاتر. پەنیر. لەسەر. تۆست.,worry,easywayout,feel. sick. too. much. cheese. on. toast.,feel. sick. too. much. cheese. on. toast.,نیگەران
1962708802,نەخێر 10ی 2 مانگ=],happiness,som1kewl,No 10th  2 months=],No 10th 2 months=],بەختەوەر
1962709848,کە دەمژێت بەجدی هیوادارم بەم زووانە هەست بە باشتر بوون بکەیت، پێویستە هەفتەی داهاتوو بێیتە سەر!!!,sadness,jerseymoongirl,"@simplysinister that sucks  I seriously hope you feel better soon, you need to come over next week!!!","that sucks I seriously hope you feel better soon, you need to come over next week!!!",دڵتەنگ
1962709944,بە درێژایی ڕۆژ زۆر خۆش بووە، ئێستاش وا دیارە باران دەبارێت...تەنها کاتێک کە پەرۆش بووم بۆ وێنەگرتن کاتێک دەگەمەوە ماڵەوە,happiness,angelawrites,"it's been so nice all day, and now it looks like it's going to rain...just when i was getting excited about taking photos when i get home","it's been so nice all day, and now it looks like it's going to rain...just when i was getting excited about taking photos when i get home",بەختەوەر
1962710048,بەڵێ کە یەکێک کاردەکات. من پۆتبێلیم خۆشدەوێت بەڵام ناتوانم لە AZ بەدەستی بهێنم دەبێت چاوەڕێی گەشتەکانی چی-تاونم بکەم,love,MelissaPR,@AYoungOne Yep that one works. I LOVE Potbelly but I can't get it in AZ  Have to wait for my Chi-town trips @PotbellySdchWks,Yep that one works. I LOVE Potbelly but I can't get it in AZ Have to wait for my Chi-town trips,خۆشەویستی
1962710492,من. سەری لێ شێواوە لەبارەی کابرایەکەوە...ئەو گەورەیە بەڵام بۆچی پاڵ دەنێم؟,worry,madtap22,@iamdiddy me.  confused about a guy...he's great but why am I pushing him away?,me. confused about a guy...he's great but why am I pushing him away?,نیگەران
1962711269,Ooh! خۆزگە من لەوێ بوومایە.تەنها سەیری Hollyoaksم کرد لە E4.So دڵتەنگ، تکایە کریس بەجێ مەهێڵە!,worry,sln25373,"@fountain1987 Ooh!Wish i was there.Just watched Hollyoaks on E4.So sad,please dont leave chris!","Ooh!Wish i was there.Just watched Hollyoaks on E4.So sad,please dont leave chris!",نیگەران
1962711455,هۆتی پووه!!!! ooo گرەو دەکەم sounda سیحراوی (HH) im دێمە ماڵەوە لە 1 کاتژمێر,fun,princesspooh90,@billbathgate hotttie poooh!!!! ooo i bet it sounda magical (HH) im coming home in 1 hour,hotttie poooh!!!! ooo i bet it sounda magical (HH) im coming home in 1 hour,خۆشی
1962711781,ئای نا! هەوادارەکەم شکا NOOOOOOOOOOOO! زۆر باشە ئێستا دەبێت لە گەرمادا ئاوسێنم. من حەزم لە گەرمی-ish بەڵام گەرمە! لاپتۆپەکەم گەرمە هەروەها.,worry,ezza122,OH NO! MY FAN BROKE  NOOOOOOOOOOOO! great now i have to swelter in the heat. i like heat-ish but it hot! my laptop warm as well.,OH NO! MY FAN BROKE NOOOOOOOOOOOO! great now i have to swelter in the heat. i like heat-ish but it hot! my laptop warm as well.,نیگەران
1962711785,داوای لێبووردن دەکەم,love,mslindaday,@DopeAlicious I'm sorry,I'm sorry,خۆشەویستی
1962712054,تازە تەلەفۆنم کرد و فرۆشرا. bummer. جاری داهاتوو!,sadness,hellohouston,@kyle_newman i just called and it's sold out.  bummer. next time!,i just called and it's sold out. bummer. next time!,دڵتەنگ
1962712087,ئەمە خەمبارە,worry,KayleenDuhh,This is sad,This is sad,نیگەران
1962712476,تازە دیسککردنم تەواو کردووە، دوو دیسکم لە دوو ڕۆژی ڕابردوودا دۆزیەوە. ڕەق. خۆزگە باشتر مامەڵەی لەگەڵ کوزیەکەمدا دەکرد و فڕێی نەدایە دەوروبەرم,worry,TheAndrewKane,"Just got done discing, found two discs in the last two days. Solid.  Wish @pacheros would treat my koozie better and not throw it around","Just got done discing, found two discs in the last two days. Solid. Wish would treat my koozie better and not throw it around",نیگەران
1962712694,خواردنی دانەوێڵەی هاوژوورەکەم. ببورە براکەم,neutral,Dahltin,eating my roommate's cereal. sorry bro,eating my roommate's cereal. sorry bro,ئاسایی
1962712923,ئیم ئاواتەخوازم کە کۆتایی هەفتە پشوو بووم بۆ ئەوەی بتوانم بچمە SOL.,sadness,Melkayway,Im wishing that i had the weekend off so i can go to SOL.,Im wishing that i had the weekend off so i can go to SOL.,دڵتەنگ
1962712948,تەنها خواردنەوەیەکی وزەبەخشم تاقیکردەوە بۆ ئەوەی ڕاپۆرت بۆ ئێوەی بەڕێز، و ئارەقکردنەوەم و خراپترین گرژبوونم هەیە. دەمەوێت پاڵ بکەوم,worry,DietSarah,"Just tried an energy drink to report back for you guys, and im sweating and have the worst cramps. I want to lie down","Just tried an energy drink to report back for you guys, and im sweating and have the worst cramps. I want to lie down",نیگەران
1962713609,ڕۆژێکی جوانی MN ە، بەڵام من لەناوەوە گیرم خواردووە و ڕۆڵی Zelda دەگێڕم. من دەبێت لانیکەم ١٠ کاتژمێر یاری بکەم. ئەمڕۆ.,happiness,mnemosynekurai,"@danosphere It's a beautiful MN day, but I'm stuck inside playing Zelda.  I've gotta play at least 10 hrs. today.","It's a beautiful MN day, but I'm stuck inside playing Zelda. I've gotta play at least 10 hrs. today.",بەختەوەر
1962714039,هی بریستۆڵ ئیشەکەیە! من زۆرم خۆشدەوێت نانخواردنی نیوەڕۆیان لە ڕۆژانی یەکشەممەدا. ڕوت کریس باشە بەڵام جارێک لەوێ نەخۆش کەوتم.,love,dannigyrl,@michemo Bristol's is the ish! I LOVE their brunch on Sundays. Ruth Chris is good too but I got sick there once.,Bristol's is the ish! I LOVE their brunch on Sundays. Ruth Chris is good too but I got sick there once.,خۆشەویستی
1962714118,من دەزانم im inlove لەگەڵ لە ڕاستیدا..,love,NinaRampz,@oneofthosefaces i know im inlove with  @katyperry actually..,i know im inlove with actually..,خۆشەویستی
1962714319,باشە کچەکەم ئێستا ٢٠ ساڵە...thats why من وتم 'بیری ئەو ڕۆژانە دەکەم'...ئەوان زۆر خێرا تێدەپەڕن,sadness,SavingEveryday,@thriftymommy well my daughter is 20 now...thats why I said 'I miss those days'...they go by sooo fast,well my daughter is 20 now...thats why I said 'I miss those days'...they go by sooo fast,دڵتەنگ
1962714445,بەسەربردنی زۆربەی کۆتایی هەفتە بە کارکردن.. ئەوە تەنانەت دەنگێکی خۆشیشی نییە,sadness,tracy3577,spending most of the weekend working.. that doesn't even sound fun,spending most of the weekend working.. that doesn't even sound fun,دڵتەنگ
1962714587,تاقیکردنەوەی دەسکتۆپی Hulu. وەشانێکی گەوادتری بۆکسیم بیردەخاتەوە. هەست بە چەقبەستوویی دەکات، گەڕان زۆر شاراوەیە، سیستەمی مینیوەکە جێگەی پرسیارە.,worry,bruce,"Testing out Hulu desktop. Reminds me of a shittier version of boxy. Feels clunky, search is too hidden, the menu system is questionable.","Testing out Hulu desktop. Reminds me of a shittier version of boxy. Feels clunky, search is too hidden, the menu system is questionable.",نیگەران
1962715029,Ohhhhh چۆن بیری برنچ دەکەم,sadness,PARISnHOLLYWOOD,@BiffBarker Ohhhhh how I miss the Brunch,Ohhhhh how I miss the Brunch,دڵتەنگ
1962715577,ئەی خوایە. من بە واتایەکی ڕەسەن لە بارانێکدا لێمخوڕی کە ئەوەندە سەخت بوو کە نەمدەتوانی لەبەردەممدا ببینم. دەلەرزم,worry,HeyAshleyHey,Oh my god. I literally drove in rain that was so hard that i couldn't see in front of me. I'm shaking,Oh my god. I literally drove in rain that was so hard that i couldn't see in front of me. I'm shaking,نیگەران
1962715957,ئۆپ، لەبیرم چوو ئەمڕۆ لە شوێنی کارەکەمان کبابێک دەکەین! ئاخر پێویستم بە پاکەتکردنی نانی نیوەڕۆ نەبوو,sadness,drewbenn,"Oops, forgot we are having a barbecue at work today! I didn't need to pack a lunch after all","Oops, forgot we are having a barbecue at work today! I didn't need to pack a lunch after all",دڵتەنگ
1962716384,"لە ماڵەوە ماڵ بە تەنیا , یاری گیتار هەندێک پاڵەوانی گیتار بە دەنگی بەرز.",love,alishaa312,"at the house home alone   , playing guitar some guitar hero loud.","at the house home alone , playing guitar some guitar hero loud.",خۆشەویستی
1962716696,زۆر خۆشە من ahd بۆ کارکردن ئەمڕۆ,relief,Mrsjnr,@stevico1 Its so nice i ahd to work today,Its so nice i ahd to work today,ئارام
1962716867,کچێک دەزانی جوانی باجی هەیە,neutral,D_Educator94,@solangeknowles girl you know beauty has a price,girl you know beauty has a price,ئاسایی
1962717057,lolll، من cba بۆ بەدەستهێنانی شتەکانی خۆر و من لەبیرم چوو کە پشتی قاچم wouldnt gwt tanned خخخخ. ئازاری زۆر خراپە لە ئێستادا,hate,alexd_xo,"@CourtJsallis  lolll, i cba to get the sun stuff and i forgot that the back of my leg wouldnt gwt tanned lol. it hurts sooo bad right now","lolll, i cba to get the sun stuff and i forgot that the back of my leg wouldnt gwt tanned lol. it hurts sooo bad right now",ڕق
1962717066,ئەو سەیری شەڕەکانی کلۆنی کارتۆنی کردووە، و بە تەواوی کەوتۆتە ناو هێزەکەوە. شانۆن ڕێگەی پێنادات هێشتا ئەوانەی زیندوو ببینێت tho,neutral,uglyplaidshorts,"@ginamc she's been watching the cartoon clone wars, and she's totally into the force.  Shannon won't let her see the live ones yet tho","she's been watching the cartoon clone wars, and she's totally into the force. Shannon won't let her see the live ones yet tho",ئاسایی
1962717674,دۆست زۆر داوای لێبوردن دەکەم!!!!! من هەرگیز ئەو ژمارەیەم بۆ تۆ وەرنەگرتووە شکستەکەم تەنها بیرم هاتەوە,worry,djvillin,@yayamartinez dude i am so sorry!!!!! I never got that number for you my fail  i just remembered,dude i am so sorry!!!!! I never got that number for you my fail i just remembered,نیگەران
1962717675,کچە ئەگەر بەشێک بوویتایە لە گەشتەکە، بەجدی من یەکەم کەس دەبووم لە ڕیزدا بۆ وەرگرتنی بلیت. تەنها وتم'.,happiness,ellamaehere,"@agcruc Girl, if you were part of the tour, I would seriously be the first in line for tickets.  Just sayin'.","Girl, if you were part of the tour, I would seriously be the first in line for tickets. Just sayin'.",بەختەوەر
1962717716,من زۆر جێڵزم. من خانووم دەوێت. &gt;,sadness,schmoopsiepoo,I am so jelz. I want a house. &gt;,I am so jelz. I want a house. &gt;,دڵتەنگ
1962717744,بەڕاستی ئەو خەریکی کەسانی نوێ نییە I dunno em بەڵام وتی هەوڵ دەدەم,neutral,SadieRaeMartin,@Em_Fizz he's really not into new people  I dunno em but he said he'd try,he's really not into new people I dunno em but he said he'd try,ئاسایی
1962717868,سەیرکردنی فیلمی The Uninvited لە ژوورەکەمدا. ناتوانم چاوەڕێ بکەم تا بگەڕێمەوە ماڵەوە. بەڵام دەبێت سەرەتا بچمە لای دەید.,worry,samantha_ehm,watching The Uninvited in my room. Can't wait to go home. But I have to go to the Deid first.,watching The Uninvited in my room. Can't wait to go home. But I have to go to the Deid first.,نیگەران
