tweet_id,kurdish_tweets,sentiment,author,content,tweets,kurdish_sentiments
1957191925,ناتوانم بخەوم. من ناتوانم پەڕۆی داپیرەم بدۆزمەوە و نە لۆکێتەکەی. من لە خۆم نەخۆشم چونکە ڕەنگە بە جۆرێک لە جۆرەکان لەدەستم دابن. یان دزراون,worry,OnyxWolf,I can't sleep. I can't find my grandmother's quilt or locket. I'm sick at myself cause I may have lost them somehow. Or they were stolen,I can't sleep. I can't find my grandmother's quilt or locket. I'm sick at myself cause I may have lost them somehow. Or they were stolen,نیگەران
1957192084,پێم وابوو وێنەی ئۆتۆمبێلە پاکەکەت دەبینم,worry,Nightmarelynn,@ZachMoore1 I thought I was going to see a pic of your clean car,I thought I was going to see a pic of your clean car,نیگەران
1957192167,ده‌مه‌وێ كه‌! بەڵام من لە سەرووی ١٨ ساڵم نییە و t&amp;c دەڵێت سەرووی ١٨ ساڵان تەنها دەیانەوێت ئیستسناءێک بۆ من بکەن ;),worry,chelsea_playboy,@hot30 i want to! but im not over 18 and t&amp;c says over 18's only  wanna make an exception for me ;),i want to! but im not over 18 and t&amp;c says over 18's only wanna make an exception for me ;),نیگەران
1957192307,نەخێر، بەڵام کاری سەرسوڕهێنەر دەکات لەگەڵ هێشتنەوەی هەموو گفتوگۆ ئۆنلاینەکانت لە یەک شوێن... بەداخەوە ئەو شوێنە گووگڵە,worry,mensoh,"@ingridkerr No, but it does amazing things with keeping all your online conversations in one place... unfortunately that place is Google","No, but it does amazing things with keeping all your online conversations in one place... unfortunately that place is Google",نیگەران
1957192397,ببورە، تەنها بە زمانی ئیسپانییە بۆ ئێستا,sadness,androidinfo,"@rscheuer sorry, is only in spanish for the moment","sorry, is only in spanish for the moment",دڵتەنگ
1957192464,یایـیـیـیـیـیـیـیـیە!!!!! بەڵام thats sp دوور!,worry,ash1225,@ddlovato Yayyyyyyyyyyy!!!!! but thats sp far away!,Yayyyyyyyyyyy!!!!! but thats sp far away!,نیگەران
1957192594,دەبێت DVR ـم پاک بکەمەوە... سبەی ڕزگارم بێت لێی.,fun,itsurgirld,must clear out my DVR... getting rid of it tomorrw.,must clear out my DVR... getting rid of it tomorrw.,خۆشی
1957192957,Bummed کە F! و! و! جیابوونەوە,hate,LucHeidenreich,Bummed that F! F! F! broke up,Bummed that F! F! F! broke up,ڕق
1957192967,من ناوم تۆمار کرد بۆ ئەکاونتێک لە ماڵپەڕێکی سیاسی تا بتوانم کۆمێنتێک پۆست بکەم بەڵام کار ناکات.,neutral,teiladnam,I signed up for an account on a political website so I could post a comment but it isn't working.,I signed up for an account on a political website so I could post a comment but it isn't working.,ئاسایی
1957193010,چۆنە هەرگیز ناتوانم لە ڕابردوودا بخەوم؟؟ باش نییە,neutral,UggGirlie,How Come I Can Never Sleep Past?? Not Good,How Come I Can Never Sleep Past?? Not Good,ئاسایی
1957193022,قسەی گشتیم لە مانگی تەمموزدا هەڵوەشایەوە و نازانم بۆچی.,worry,HalfCentaur,@Sageey My public talk in July got canceled and I don't know why.,My public talk in July got canceled and I don't know why.,نیگەران
1957193805,من دەمویست بەڵام وەک 1800 یان 1000+ میل نرخی غاز شێتانە im doing alpine هاوینی داهاتوو زۆربەی def,neutral,DMB_,@typicalrouse I would but its like 1800 or 1000+ miles  gas prices are crazy im doing alpine next summer most def,I would but its like 1800 or 1000+ miles gas prices are crazy im doing alpine next summer most def,ئاسایی
1957194036,ئەمڕۆ هەست بە زبرییەکی زۆر دەکەیت، تەنها ئامێز و کەمێک خەوتنت دەوێت,worry,Becky548,"Feeling so rough today, just want a cuddle and some sleep","Feeling so rough today, just want a cuddle and some sleep",نیگەران
1957194329,ئای نەخێر ئابووری گۆتچا؟ ببورە بەڵام زۆر دڵخۆشم کە یەکێکی ترت لە LA دەستکەوت! چێژ لە سۆکال وەربگرە! ئاهاهای! وای,happiness,tineymarie,@cha_rade oh no the economy gotcha?  sorry but so happy that you got another one in LA!  Enjoy SoCal! Ahahaay! LOL,oh no the economy gotcha? sorry but so happy that you got another one in LA! Enjoy SoCal! Ahahaay! LOL,بەختەوەر
1957194339,ئەنفلۆنزاکە لەلایەن ئەندییەوە بۆم تێپەڕاندووە...چوومە بازاڕکردن و مریشکی تازەم بۆ شۆربای مریشک وەرگرتووە...بەڵام هیچ d&amp;d ئەم دانیشتنە ...پاندایەکی دڵتەزێنە,worry,HighandDriving,"@portugaltheman Where'd the songs go on the site, I want &quot;Do You&quot; on this computer too","Where'd the songs go on the site, I want &quot;Do You&quot; on this computer too",نیگەران
1957194454,گۆرانییەکان لە سایتەکەدا بۆ کوێ ڕۆیشتن، من دەمەوێت &quot;Do You&quot; لەسەر ئەم کۆمپیوتەرەش,sadness,circelilith,has had the flu pass unto me by andy...went shopping and got fresh chicken for chicken soup...but no d&amp;d this sat ...is a sad panda,has had the flu pass unto me by andy...went shopping and got fresh chicken for chicken soup...but no d&amp;d this sat ...is a sad panda,دڵتەنگ
1957194726,باش نییە,neutral,henouk,has an exam at 10am - I slept about 3 hours last night,has an exam at 10am - I slept about 3 hours last night,ئاسایی
1957194802,کاتژمێر ١٠ی بەیانی تاقیکردنەوەیەکی هەیە - دوێنێ شەو نزیکەی ٣ کاتژمێر خەوتم,sadness,CiaranActon,not well,not well,دڵتەنگ
1957194936,ئای چ ڕێگایەکی جەهەنەمیە پێم بڵێم.,sadness,bloodlusttypo,@Miss_Rain oh what the hell  way to tell me.,oh what the hell way to tell me.,دڵتەنگ
1957195159,خۆزگە لە ئۆهایۆ یان لانیکەم تاڕادەیەک نزیک بوومایە! نەمبینیوە یان نزیکەی ساڵێکە.,neutral,laurenmikael,Wish I lived in or atleast relatively close to Ohio!   Haven't seen @SmallTown_Troy or @Derk_McLoven in almost a year.,Wish I lived in or atleast relatively close to Ohio! Haven't seen or in almost a year.,ئاسایی
1957195244,ئای گەمژە!!,sadness,She_shines92,@theblackestsea oh crap!!,oh crap!!,دڵتەنگ
1957195455,بۆیە کارلی هاتە لای و لەسەرم خەوت,happiness,seniahh,so carlie came over and she fell asleep on me,so carlie came over and she fell asleep on me,بەختەوەر
1957195514,و لە ماوەی کورتدا لە دوایین ئاماژە هەموویان,neutral,velofille,@3Gguy and within a short time of the last clue all of them,and within a short time of the last clue all of them,ئاسایی
1957195703,مۆبایلەکەم هێشتا تویت ناکات,neutral,VictoriaDoyle,my phone still doesnt tweet,my phone still doesnt tweet,ئاسایی
1957195915,بیرۆکەیەکی باشە مێشک، ناتوانیت لە تویتەر نەبیت...,neutral,karinb_za,"@blindcripple Good idea Brain, you can't not be on Twitter...","Good idea Brain, you can't not be on Twitter...",ئاسایی
1957195949,من msgەکەم بەدەست نەهێنا!! :'( بەڵام من شازادەم کڕی,sadness,StephiieG,@shaundiviney i didnt get the msg!! :'( but i bought princess,i didnt get the msg!! :'( but i bought princess,دڵتەنگ
1957196056,تازە ماڵپەڕی کتێبخانەم پشکنیوە و کچێک بە تاتۆی ئەژدیها سەیری کراوە,love,sandrawheelis,"Trying to learn how to do this &quot;twitter&quot; thing... I'll get there. Welcome to all my followers, though Im not that interesting","Trying to learn how to do this &quot;twitter&quot; thing... I'll get there. Welcome to all my followers, though Im not that interesting",خۆشەویستی
1957196074,هەوڵدان بۆ فێربوونی چۆنیەتی ئەنجامدانی ئەم کارە &quot;تویتەر&quot; شت... من دەگەم بەو شوێنە. بەخێربێن بۆ هەموو فۆڵۆوەرەکانم، هەرچەندە Im ئەوەندە سەرنجڕاکێش نییە,neutral,Lyoung6168,@mrskutcher just checked library website and girl with dragon tattoo is checked out,just checked library website and girl with dragon tattoo is checked out,ئاسایی
1957196203,خخخ ik ئەوانن، بەڵام من زانیم کە من بۆ ماوەی ساڵێک هێشتوومەتەوە+ بەبێ ئەوەی پێویستم بە نەرمەکاڵای ڤایرۆس بێت یان بۆ ئەوەی چاکی بکەمەوە ئاهێک,surprise,badtwin,"@movewithme lol ik they are, but i figure i've kept it for a year+ without needing virus software or to get it fixed  sigh","lol ik they are, but i figure i've kept it for a year+ without needing virus software or to get it fixed sigh",سوپرایز
1957196764,یەکەم بزەی ڕۆشت 2 ماڵێکی نوێ.,worry,gailey1305,first puppy gone 2 new home.,first puppy gone 2 new home.,نیگەران
1957196825,زۆر دڵخۆشم کە لێرەم. ڕقم لێیەتی. کاریگەری لەسەر هەموو شتێک هەیە. پەیوەندییەکانم لەگەڵ خەڵک، کەسایەتیم، هەڵوێستم...,sadness,gemmy628,"I'm so unhappy being here. I hate it. It's affecting everything. My relationships with people, my personality, my attitude...","I'm so unhappy being here. I hate it. It's affecting everything. My relationships with people, my personality, my attitude...",دڵتەنگ
1957196855,لە ئێستادا هیچ شتێک نییە بیکەم و ماندووم بەڵام نامەوێت بخەوم. پاککرایەوە زۆر باش، زۆر شانازی. لانی کەم من دەرگاوانێکی باش دەبووم,sadness,itsToniA,"There's Nothing To Do Right Now And I'm Tired But I Don't Want To Sleep. Cleaned Up Pretty Good, So Proud. At Least I'd Be A Good Janitor","There's Nothing To Do Right Now And I'm Tired But I Don't Want To Sleep. Cleaned Up Pretty Good, So Proud. At Least I'd Be A Good Janitor",دڵتەنگ
1957197501,هەستکردن بە نەخۆشییەکی زۆر,worry,VictoriaDoyle,feeling extremally ill,feeling extremally ill,نیگەران
1957197786,ئای من... ئێستا من توڕە بووم. ها,sadness,LaurenKayW,@Madush oh my... now im offended.  ha,oh my... now im offended. ha,دڵتەنگ
1957198077,لە دەرەوەی کارەکەم، هەوڵدەدەم بۆ ماوەی نزیکەی ٣٠ خولەک ئارام بگرم پێش ئەوەی بخەومەوە,relief,Caitlinmfg,"Off work, trying to relax for about 30 mins before I've gotta go back to sleep","Off work, trying to relax for about 30 mins before I've gotta go back to sleep",ئارام
1957198359,بەڵێ باش بوو 2 ببینن بە یەکتر پێدەکەنن،،بەڵام ئەو کوڕە هەژارە پرسیاری لە دایکی &amp; باوک ٢ بیکوژن,hate,Dutchrudder,"@StonedSteve yes it was good 2 see them laught at each other,,but that poor lad asking his mum &amp; dad 2 kill him","yes it was good 2 see them laught at each other,,but that poor lad asking his mum &amp; dad 2 kill him",ڕق
1957198430,من لەسەر کارم,neutral,benmfowler,I'm at work,I'm at work,ئاسایی
1957198551,&quot;ناوم تۆنییە!!!!!! ...نەک هێی!!!!&quot; - تۆنی هەژار,worry,urtherevolution,&quot;my name is Tony!!!!!! ...not hey!!!!&quot; -  poor tony,&quot;my name is Tony!!!!!! ...not hey!!!!&quot; - poor tony,نیگەران
1957198598,گۆرانییەکان لە سایتەکەدا بۆ کوێ ڕۆیشتن، من دەمەوێت &quot;Do You&quot; لەسەر ئەم کۆمپیوتەرەش,neutral,HighandDriving,"@portugaltheman @liftingfaces Where'd the songs go on the site, I want &quot;Do You&quot; on this computer too","Where'd the songs go on the site, I want &quot;Do You&quot; on this computer too",ئاسایی
1957198802,کاتەکانی گەڕانەوە. خۆزگە جارێکی تر هەرزەکار بوومایە. خۆزگە جارێکی تر هەست بە تەندروستی بکردایەتەوە. ئیتر ناتوانم لەبیرم بێت هەستکردن بە تەندروستی چۆنە.,worry,LatinAngel9393,back time.  I wish I was a teenager again. I wish I could feel healthy again. I can't remember what it's like to feel healthy anymore.,back time. I wish I was a teenager again. I wish I could feel healthy again. I can't remember what it's like to feel healthy anymore.,نیگەران
1957198814,وەشانی 3d ی Up فرۆشرا وەشانی ئاسایی خۆیەتی!,sadness,KatrinaMarieee,The 3d version of Up sold out   regular version it is!,The 3d version of Up sold out regular version it is!,دڵتەنگ
1957198981,من ئیتر ur #...م نییە، پێم وایە!!,worry,gudnewzcixx,"@YEPNAYDEA I don't have ur #...anymore, I think!!","I don't have ur #...anymore, I think!!",نیگەران
1957199055,خۆشەویستی من!!! ئێمە هێشتا havn't نەخواردنی نیوەڕۆ پێکەوە وەک ئەوەی گوتمان دەیکەین.. بیرت دەکەم هاوڕێکەم,sadness,Nickygeezy,@NickTheIntern my love!!! We still havn't done lunch together like we said we would.. I miss you my friend,my love!!! We still havn't done lunch together like we said we would.. I miss you my friend,دڵتەنگ
1957199368,بۆ هەموو هاوڕێکانم: بە قووڵی ببورە کە دەجووڵێم، زۆر زۆر بیری هەمووتان دەکەم!,happiness,kittykatorphan,"To all my friends: Im deeply sorry i'm moving, i will miss u all so very very much!","To all my friends: Im deeply sorry i'm moving, i will miss u all so very very much!",بەختەوەر
1957199401,کوا bestie من کاتێک پێویستم پێیەتی,surprise,Jazzy813,Where is my bestie when i need him @iAmcertiPHIed,Where is my bestie when i need him,سوپرایز
1957199558,نەفرەت شتێکم هەیە بیڵێم و کەس گوێی لێناگرێت,neutral,YOUNG_KC,@CheetahmamiBia oooo ok   why  havent you accepted my friends request,oooo ok why havent you accepted my friends request,ئاسایی
1957199632,oooo باشە بۆچی داواکاری هاوڕێکانمت قبوڵ نەکردووە,worry,turbowanda,Damn i have something to say and no one is listening,Damn i have something to say and no one is listening,نیگەران
1957200791,تازە گەیشتمە ماڵەوە دوای کوشتنی پۆسۆمێک,neutral,vrodriguez420,just got home after killing a possum,just got home after killing a possum,ئاسایی
1957201369,OMG YAYA!!! ئێمە #5ت دانا تکایە نەک کۆتایی ساڵ,worry,Samm_xo,@Jessicaveronica OMG YAYA!!! we put you #5 please not the end of the year,OMG YAYA!!! we put you #5 please not the end of the year,نیگەران
1957201670,بیری منی تەندروستە کۆنەکە دەکەم و باوەڕم لەدەست دەدەم کە هەرگیز جارێکی تر دەبمەوە,worry,LatinAngel9393,I miss the old healthy me and I am loosing faith that I ever will be again,I miss the old healthy me and I am loosing faith that I ever will be again,نیگەران
1957202373,جەهەنەم بەڵێ! من بیری u last nite lol do u like y my openly?,fun,Embabe09,@Jukie_08 hell yeah! i missed u last nite  lol do u like my opinion?,hell yeah! i missed u last nite lol do u like my opinion?,خۆشی
1957202477,دەچمە خوارەوە بۆ ئەوەی هەوڵبدەم هەندێک Z بگرم، دوای سبەی خوێندنی ئامادەیی چیتر! کە بەڕاستی دەمژێت خۆزگە من نەمکرد.. http://tinyurl.com/lk9ag8,worry,reallysucks,"gonna get off to try and catch some Z's, no more high school after tomorrow! which really sucks  i wish i didn.. http://tinyurl.com/lk9ag8","gonna get off to try and catch some Z's, no more high school after tomorrow! which really sucks i wish i didn.. http://tinyurl.com/lk9ag8",نیگەران
1957202674,... ئەوە هەموویەتی,neutral,ivyivydeliz,... that's all,... that's all,ئاسایی
1957202990,ڕاور و چیتر. ئەمشەو شەوێکی جوانی وێنەکێشانم هەیە... تەنانەت پێشکەوتنی کەمتر لەوەی چاوەڕێم دەکرد.,worry,Mattdennis,Rawr and whatnot. I am having a godawful drawing night tonight... even less progress has been made than I expected.,Rawr and whatnot. I am having a godawful drawing night tonight... even less progress has been made than I expected.,نیگەران
1957203110,suuure,happiness,ErictheAzn,@allyycase suuure,suuure,بەختەوەر
1957203255,بیری وتەی ڕۆژانەم دەکەم! بۆچی ئیتر دەستیان ناکەوێت؟ ئایا من لە لیستی پۆستەکانت دەرکراوە؟,neutral,hash_yahoo,@anshprat yahoo maps! lots more to desire #yahoo,yahoo maps! lots more to desire #yahoo,ئاسایی
1957203256,نەخشەکانی یاهوو! زۆر شتی تر بۆ ئارەزووی #yahoo,worry,dereckbreuning,I miss my daily quotes! Why don't i get them anymore? @sschabowski am I kicked from your mailinglist?,I miss my daily quotes! Why don't i get them anymore? am I kicked from your mailinglist?,نیگەران
1957203878,ئێستا ئازاری هەیە &amp; لەرزەکان پەیوەندییان بەو حزبەوە کردووە. بۆچی سەرما نەیتوانی تەنها بڕوات؟ دەبوو خراپتر بێت؟,sadness,singingchef85,now aches &amp; chills have joined the party. Why couldn't the cold just go away? It had to get worse?,now aches &amp; chills have joined the party. Why couldn't the cold just go away? It had to get worse?,دڵتەنگ
1957204382,من لێرە نابم. ئیما ب لە جۆرجیا و دواتر من دەڕۆم بۆ LA. گررررر!,worry,kalilahtwitts,@MateRiaLGirL1 I won't b hereeeeee. Imma b in georgia  and then I'm off to LA. Grrrrrr!,I won't b hereeeeee. Imma b in georgia and then I'm off to LA. Grrrrrr!,نیگەران
1957204499,"ohh sorry , thats کەسێکی تر وێنەی خراپەکەم",worry,shrikhande,"@sensonize ohh sorry , thats someone else's pic  my bad","ohh sorry , thats someone else's pic my bad",نیگەران
1957204516,"دوێنێ شەو بە 5 چرکە شەمەندەفەرەکەمم لەدەستدا knijp, jaap &amp; فلاشباک. ئێستا لەسەر تاڵە مووەکان دانیشتووە. ئەگەر دەزانن مەبەستم چییە. ;)",worry,matthysbakker,"Missed my train by 5 secs  yesterdaynight knijp, jaap &amp; flashback. Now sitting on the blisters. If you know what I mean. ;)","Missed my train by 5 secs yesterdaynight knijp, jaap &amp; flashback. Now sitting on the blisters. If you know what I mean. ;)",نیگەران
1957204629,بۆچی هێشتا uppppم؟؟؟؟؟ وای. لە ماوەی کەمتر لە ٥ کاتژمێردا کار بکە.,worry,HiImMimi,Why am I still upppp????? LOL.  Work in less than 5 hours.,Why am I still upppp????? LOL. Work in less than 5 hours.,نیگەران
1957204970,سیسەم. لەگەڵ ئازاری گەدە,sadness,audreywilles,bed. with stomach ache,bed. with stomach ache,دڵتەنگ
1957205389,ئایا هەر بۆیە وەڵامی پەیوەندییەکەم نادەیتەوە؟ پێت وابوو ئێمە هۆمیین!؟,worry,jaynedoefresh,@Bam_Hall Is that why you aint answer my call? Thought we were homies!?,Is that why you aint answer my call? Thought we were homies!?,نیگەران
1957205446,gnite Fukn Nite * sum {pinga} ی دەویست بەڵام نەیتوانی هیچی بەدەست بهێنێت,worry,cherryzntash69,gnite  Fukn Nite * wanted sum {pinga} but couldn't get any,gnite Fukn Nite * wanted sum {pinga} but couldn't get any,نیگەران
1957205757,کویزەکانی فەیسبووک یەکێکە لە چارەسەرەکانی بێزاری هاها، ددانەکانم/دەمم ئازاریان هەیە,empty,jemariie,@Tinkabellastar no. my school will start on June1.  two days to go. i still don't want. :l,no. my school will start on June1. two days to go. i still don't want. :l,بەتاڵ
1957205912,نەخێر. قوتابخانەکەم لە یەکەمی حوزەیران دەست پێدەکات. دوو ڕۆژ ماوە بۆ ڕۆشتن. هێشتا نامەوێت. :ل,neutral,sammiidizzle,"facebook quizzes are one cure of boredom haha, my teeth/mouth hurts","facebook quizzes are one cure of boredom haha, my teeth/mouth hurts",ئاسایی
1957206063,لە کۆتاییدا قبوڵکردنی ئەو ڕاستییەی کە هەموو کوڕە نازدارەکان دەگیرێن,sadness,lrharley,lappy charger is completely dead... conserving what's left of the battery until i can afford to buy a new one,lappy charger is completely dead... conserving what's left of the battery until i can afford to buy a new one,دڵتەنگ
1957206142,بارگاویکەرەوەی lappy بە تەواوی مردووە... پاراستنی ئەوەی لە پاترییەکە ماوە تاوەکو توانای کڕینی نوێم هەیە,sadness,yuetmui,finally accepting the fact that all cute guys are taken,finally accepting the fact that all cute guys are taken,دڵتەنگ
1957206274,سامەر گلاو ساڵی داهاتوو لە دۆلهاوس دەردەکەوێت http://tinyurl.com/mnrezc... هێشتا باوەڕم بەوە نییە کە TSCC نوێ نەکەنەوە,surprise,ziggywas,Summer Glau to appear in Dollhouse next year http://tinyurl.com/mnrezc... I still can't believe they won't renew TSCC,Summer Glau to appear in Dollhouse next year http://tinyurl.com/mnrezc... I still can't believe they won't renew TSCC,سوپرایز
1957206336,منیش یەکێکم هەیە هەرچەندە پێموایە هی من دەگەڕێتەوە بۆ نمایشی ڕەنگ/ڕووناکی هاندەری گرژبوون لە فیلمی The Soloist.,worry,RochelleReyes,"Finally watched the rest of The Guild Season 2. I always feel so sorry (and hopeful at the same time) for your char, @feliciaday","Finally watched the rest of The Guild Season 2. I always feel so sorry (and hopeful at the same time) for your char,",نیگەران
1957206343,لە کۆتاییدا سەیری بەردەوامی وەرزی دووەمی The Guildم کرد، هەمیشە زۆر بەزەییم (و لە هەمان کاتدا هیوادارم) بۆ چارەکەت،,neutral,JerrodK,@debbylovespr I've got one too  though i think mine was attributed to the seizure inducing color/light show in the movie The Soloist.,I've got one too though i think mine was attributed to the seizure inducing color/light show in the movie The Soloist.,ئاسایی
1957206401,ناتوانم بچمە ناو سایتەکەتەوە!,hate,delboy1203,@GoblinZA Can't access your site!,Can't access your site!,ڕق
1957206634,ناتوانم!!! دڵم ئازاری هەیە بۆ منداڵەکانی دەمەوێت ئەلێکسیس بەخێو بکەم,love,frekklz,@craftjoshua I CAN'T!!! My heart aches for her children  I wanna adopt alexis,I CAN'T!!! My heart aches for her children I wanna adopt alexis,خۆشەویستی
1957206666,نیوەڕۆ دەچووە ماڵەوە بۆ پشوودان...ئەمڕۆ باش نەبوو,love,Kelndan,@TicketChoice lunch was going home to rest...not well today,lunch was going home to rest...not well today,خۆشەویستی
1957206844,شەوی هەمووتان باش.,neutral,MRSCAMPOS,goodnight everyone.,goodnight everyone.,ئاسایی
1957207123,ئەو کرێکارانەی درێژکردنەوەی بلۆکی R ناتوانن ئەم زوو دەستپێبکەن بە دڵنیاییەوە.. کاتژمێر 7:45ی بەیانیەکەی و لە ئێستاوە ڕاکێتێک دروست دەکەن و منیان لە خەو هەڵساند!,empty,chris_sponge,those workmen extending R block can't start this early surely.. its 7:45am and already they're making a racket and woken me up!,those workmen extending R block can't start this early surely.. its 7:45am and already they're making a racket and woken me up!,بەتاڵ
1957207318,بیرت ئەکرێ!! زنجیرێکی کلیلم بۆ بێنەوە!,sadness,pamvila,@HazelAngeli @V0TR0N  too bad Vo got me sick I think  &amp; I don't even have meds to feel like you.,too bad Vo got me sick I think &amp; I don't even have meds to feel like you.,دڵتەنگ
1957207392,زۆر خراپە ڤۆ نەخۆش کەوتم پێم وایە &amp; تەنانەت دەرمانیشم نییە هەست بە تۆ بکەم.,neutral,denis_v_pavlov,@IsaGoksu  http://yfrog.com/11z2ip  nothing there,http://yfrog.com/11z2ip nothing there,ئاسایی
1957207486,http://yfrog.com/11z2ip هیچ لەوێ,empty,leslie666,@Steinmoney      You'll be missed!!  Bring me back  a keychain!,You'll be missed!! Bring me back a keychain!,بەتاڵ
1957207781,تەنها ڕۆژێکی تر لە جەی لینۆ que sad!,enthusiasm,kinarodriguez,Only one more day of Jay Leno  que sad!,Only one more day of Jay Leno que sad!,پەرۆش
1957207790,هۆنزا بەیانی بە گەشتەکەی دەگەڕێتەوە بۆ کۆماری چیک بەڕاستی بیری دەکەم.,worry,antandbecks,"Just spoke to Keith Urban's record company, we can't get him on the show till we're back from holidays  sorry Jack, we're trying mate!","Just spoke to Keith Urban's record company, we can't get him on the show till we're back from holidays sorry Jack, we're trying mate!",نیگەران
